date,headline,summary
2025-01-10 18:59:15+00:00,Nvidia's AI Leadership Shines While ON Semiconductor Faces Demand Slump: Analyst,"Analyst William Stein reports on CES 2025, highlighting strong AI infrastructure spending, benefiting Nvidia and increasing target for Analog Devices."
2025-01-10 17:59:46+00:00,"Wall Street Tumbles On Blowout Payrolls, Oil Rallies To $76, US Dollar Hits 26-Month Highs: What's Driving Markets Friday?","Wall Street faced heavy selling pressure in its first trading session after former President Jimmy Carter&#39;s funeral, as a series of economic developments rattled interest rate and energy markets, sparking heightened risk aversion among investors."
2025-01-10 17:35:12+00:00,10 Information Technology Stocks Whale Activity In Today's Session, 
2025-01-10 17:34:31+00:00,"Nvidia's Lead Expands, Analyst Says: 'AI Demand Remains Very Strong'","NVIDIA Corp (NASDAQ:NVDA) leads in AI chips, expands dominance according to Bank of America analyst."
2025-01-10 16:57:02+00:00,Jack Ma Highlights AI's Future Impact Amid Biden Government's Sanction Speculations on China,"Jack Ma believes AI will reshape the world in next 10 or 20 years, as he focuses on education and agriculture. Alibaba stock up 13% in last 12 months."
2025-01-10 15:15:45+00:00,NVIDIA Options Trading: A Deep Dive into Market Sentiment, 
2025-01-10 13:44:01+00:00,"Alibaba, Baidu, JD, NIO, Li Auto Stocks Slide As Potential AI Chip Sanctions Add Pressure On China","US-listed Chinese stocks, including Alibaba, Baidu, JD.com, PDD Holdings, NIO, Li Auto, and XPeng, trade lower as US-China tensions rise over AI embargo."
2025-01-10 15:00:12+00:00,Assessing NVIDIA's Performance Against Competitors In Semiconductors &amp; Semiconductor Equipment Industry, 
2025-01-10 14:18:29+00:00,"Dollar Soars To 27-Month Highs, 30-Year Yields Hit 5%, Stocks Tumble As Jobs Report, Oil Spike Darken Fed's Interest Rate Cut Hopes","Strong jobs report fuels Fed hawkishness, spurs market fears. Unemployment drops, wages rise, rates may not be cut until 2025. Dollar and yields jump."
2025-01-10 14:17:52+00:00,"Top 10 Trending Stocks On WallStreetBets As Of January 10, 2025 (Via Swaggy Stocks)",
2025-01-10 14:02:29+00:00,NVIDIA Announces Blueprint For AI Retail Shopping Assistants,
2025-01-10 13:35:10+00:00,"Pfizer Is 'Too Low To Sell,' Jim Cramer Says: Recommends Nvidia For Robotics Exposure",Pfizer stock is down more than 7% over the past year. The pharma giant is in talks to extend its collaboration with an AI start-up.
2025-01-10 11:28:09+00:00,"Intel Stock Has Fallen Over 58% In 1 Year, But Citi Maintains 'Neutral' Rating On Expected Replacement Of Pat Gelsinger In A 'Couple Of Months'","Intel Corp discussed its priorities for 2025 with Citi Research analyst Christopher Danely, which includes the appoint of a new CEO."
2025-01-10 11:17:02+00:00,"Taiwan Semiconductor Hits $26.3 Billion Q4 Revenue, Reportedly Ends PowerAIR Deal Over Huawei Chip Breach Amid US Sanctions",TSMC reportedly ends collaboration with Singapore&#39;s PowerAIR after finding its chip in Huawei&#39;s AI processor; also faces US sanctions on Chinese customers.
2025-01-10 05:33:27+00:00,Nvidia Slams Biden's Country-Specific Chip Rules: 'Legacy That Will Be Criticized',"The proposed regulations would create three tiers of chip curbs, allowing some U.S. allies full access to American chips. "
2025-01-10 03:19:54+00:00,"Nvidia's AI Growth Boosts Advantest's Strategic Position In AI Chip Supply Chain, Stock Shows Strong Correlation With Jensen Huang-Led Tech Giant","Japanese semiconductor testing equipment maker Advantest Corp. has emerged as a key beneficiary of the artificial intelligence boom, with its stock showing a remarkable 0.93 correlation coefficient with NVIDIA Corp. over the past three years, highlighting its strategic position in the AI chip supply chain."
2025-01-11 14:30:19+00:00,"Benzinga Bulls And Bears: Rivian, Intuitive Machines, Rigetti Computing — And Dogecoin Analyst Foresees Drop To 30 Cents","Benzinga examined the prospects for many investors’ favorite stocks over the last week — here’s a look at some of our top stories.



The major indices experienced consecutive weekly losses, with the S&amp;P 500 falling 1.9%, the Nasdaq Composite dropping 2.3%, and the Dow sliding nearly 1.9% this week."
2025-01-12 17:00:17+00:00,$125 Million Home of Luminar CEO Gutted in LA Wildfires After Week of Gains for Company,"The most expensive home in California&#39;s Pacific Palisades, owned by Luminar Technologies CEO Austin Russell, has been ravaged by the ongoing Los Angeles wildfires."
2025-01-12 15:00:20+00:00,"Nvidia's AI Supercomputer, HP's $1 Billion Deal With Elon Musk's X, And Trump's AI-Driven Vision: This Week In Artificial Intelligence","Tech advancements and deals dominated the past week. Nvidia impressed at CES, HP secured a billion-dollar deal with X, and Trump shared his AI and energy vision."
2025-01-12 13:20:19+00:00,"Walgreens Boots Alliance, Aurora Innovation And Delta Air Lines Are Among Top Large Cap Gainers Last Week (Jan 6-10): Are The Others In Your Portfolio?","Top performers in last week&#39;s stock market: Walgreens, Constellation Energy, FTAI Aviation, TD SYNNEX, Aurora Innovation, Royalty Pharma, Micron, Delta Air Lines, Intra-Cellular Therapies, United Airlines."
2025-01-11 13:30:00+00:00,"Consumer Tech News (Jan 6-10): Microsoft Pauses Ambitious Data Center Project, Blackstone Makes $300 Million Investment In AI & More","Melania Trump to executive produce upcoming Amazon documentary, offering rare insight into her life and influence in Donald Trump&#39;s political world. Apple unable to sell iPhone 16 in Indonesia due to content requirements. Samsung gears up for CES 2025."
2025-01-13 21:23:06+00:00,"Analyst Sees 'Broadening Rally' In Semiconductors In 2025: 2 Top Stock Picks, 2 To Avoid",A semiconductor analyst sees a continued focus on AI growth for the sector in 2025 and highlights some winners and stocks to avoid.
2025-01-13 19:53:20+00:00,"Broadcom's $3 Billion Bet: Balancing Market Signals, AI-Driven Growth",Broadcom Inc. (AVGO) navigates bullish trend but faces selling pressure.
2025-01-13 19:22:33+00:00,"Stocks Edge Down Ahead Of Key Inflation Reports, Crude Hits 5-Month High, Bitcoin Sinks: What's Driving Markets Monday?","Traders adopted a cautious approach on Monday as they awaited two critical inflation reports due later this week, seeking clarity on Federal Reserve interest rate policy. "
2025-01-13 17:35:11+00:00,10 Information Technology Stocks With Whale Alerts In Today's Session, 
2025-01-13 17:33:48+00:00,"PUBG Developer Krafton Invests $136 Million in Game Studios, Expands AI Team for Future Gaming Innovations","Tencent&#39;s partner Krafton invests over $136M in 12 game studios, focusing on AI development. Elon Musk&#39;s xAI also plans AI-driven game studio."
2025-01-13 17:08:20+00:00,"HSBC Maintains Buy on NVIDIA, Lowers Price Target to $185",
2025-01-13 16:55:59+00:00,"Nvidia, Broadcom, Marvell Positioned For Growth As AI Demand Drives Semiconductor Momentum",Analyst N. Quinn Bolton notes 2024&#39;s divergence in fortunes for semiconductor companies exposed to different end markets. AI stocks outperformed.
2025-01-13 16:02:50+00:00,What's Going On With IonQ Stock Today?,IonQ Inc (NYSE:IONQ) shares are trading lower Monday alongside several other quantum computing stocks as the quantum sector continues to face selling pressure on the back of cautious commentary from Nvidia Corp (NASDAQ:NVDA) CEO Jensen Huang.
2025-01-13 15:37:07+00:00,"Benzinga Market Summary: Nasdaq Slides As Chip Stocks Fall On US Export Restrictions, Cleveland-Cliffs And Nucor Partner For Potential US Steel Bid, Lululemon Raises Guidance",
2025-01-13 15:00:14+00:00,Analyzing NVIDIA In Comparison To Competitors In Semiconductors &amp; Semiconductor Equipment Industry, 
2025-01-13 14:53:44+00:00,"Taiwan Semiconductor Begins 4nm Chip Production in Arizona, Eyes $11.4 Billion Q4 Profit","Taiwan Semiconductor has begun production of advanced 4-nm chips for US customers in Arizona, with a $6.6 billion grant and plans to add a third fab by 2030."
2025-01-13 14:33:54+00:00,"Top 10 Trending Stocks On WallStreetBets As Of January 13, 2025 (Via Swaggy Stocks)",
2025-01-13 14:27:23+00:00,Robots To The Rescue? Nvidia Researcher Suggests AI Could Battle Wildfires In Future,"A senior research manager at Nvidia, has pointed out the advantages of AI in firefighting."
2025-01-13 14:11:49+00:00,IQVIA Collaborates With NVIDIA To Combine IQVIA Connected Intelligence With NVIDIA AI Foundry To Help Transform Life Science Processes From R&D Through Commercialization,
2025-01-13 14:03:41+00:00,"Illumina, NVIDIA To Collaborate To 'Decode Biology And Propel Precision Health;' Illumina Shares Spike Higher",
2025-01-13 12:31:58+00:00,"Nvidia Down 3%, AMD Falls 2% After White House Imposes New AI Chip Export Restrictions","The White House on Monday declared new limitations on the export of artificial intelligence chips. This move is set to impact major tech companies, including Nvidia (NASDAQ: NVDA) and Advanced Micro Devices (NASDAQ: AMD)."
2025-01-13 11:34:10+00:00,"US Stock Futures Indicate Lower Opening On Monday After Last Week's Steep Fall: Analyst Says It's A 'Buying Opportunity,' But Market May Dip Further If This Happens",U.S. stock futures declined on Monday following Friday&#39;s steep fall. Futures of all four major indices fell in premarket trade.
2025-01-13 01:59:10+00:00,Mark Zuckerberg Backs Nvidia CEO Jensen Huang's View On Quantum Computing: 'It's Still Quite A Ways Off',"Mark Zuckerberg aligned with Jensen Huang&#39;s cautious outlook on quantum computing, suggesting the technology remains years away."
2025-01-14 20:01:34+00:00,Under the Radar: The Importance of Book Value Growth in Assessing Company Stability, 
2025-01-14 17:35:12+00:00,10 Information Technology Stocks With Whale Alerts In Today's Session, 
2025-01-14 16:58:36+00:00,Apple And Nvidia Supplier Taiwan Semiconductor Leads Semiconductor Market with 64% Share,Apple Inc (NASDAQ:AAPL) is finalizing the verification of its “made in America” processor chips from Taiwan Semiconductor Manufacturing Co’s (NYSE:
2025-01-14 15:00:14+00:00,Analyzing NVIDIA In Comparison To Competitors In Semiconductors &amp; Semiconductor Equipment Industry, 
2025-01-14 14:26:37+00:00,"Wall Street Rebounds As Producer Inflation Misses Estimates, Tesla Gains, Chinese Stocks Rally","Investors relieved by lower producer prices in Dec, easing inflation concerns. Major indices rise, traders await CPI report. Tech and discretionary stocks rebound."
2025-01-14 14:23:21+00:00,"Top 10 Trending Stocks On WallStreetBets As Of January 14, 2025 (Via Swaggy Stocks)",
2025-01-14 14:08:49+00:00,Nvidia Eyes $1 Billion In Healthcare AI Revenue: Is This The Next Growth Frontier?,Nvidia is making an ambitious leap into leveraging AI and accelerated computing to transform healthcare solutions.
2025-01-14 12:06:14+00:00,"US Semiconductor Sanctions Spell Trouble for Nvidia, But May Benefit Big Tech"," Nvidia&#39;s customers include Microsoft, Amazon, Google, and Meta Platforms. Their orders worth $10 billion were postponed due to overheating issues."
2025-01-14 10:57:18+00:00,"Dow Surges Over 350 Points, Nasdaq Falls: Investor Sentiment Improves Slightly, But Greed Index Remains In 'Fear' Zone","The CNN Money Fear and Greed index showed some improvement in overall market sentiment, while the index remained in the &#34;Fear&#34; zone on Monday."
2025-01-14 08:23:58+00:00,Joe Biden Vs. Jensen Huang: What White House's New Chip Export Restrictions Mean For Nvidia That Has The AI Giant Up In Arms,"NVIDIA Inc., the artificial intelligence powerhouse led by CEO Jensen Huang, is pushing back against new semiconductor export regulations imposed by President Joe Biden&#39;s administration. "
2025-01-14 06:59:24+00:00,"Jensen Huang Said Quantum Computing Is 20 Years Away, But Nvidia Bets Big On Strategic Hiring","While NVIDIA Corp. CEO Jensen Huang has stated that practical quantum computing is likely two decades away, the company is not waiting to invest in its future. In a strategic move, Nvidia is actively hiring for roles that will bolster its quantum computing capabilities, indicating a long-term commitment to integrating quantum and classical computing systems."
2025-01-15 17:35:15+00:00,10 Information Technology Stocks Whale Activity In Today's Session, 
2025-01-15 16:17:52+00:00,Nvidia Makes First Investment In Taiwanese Startup MetAI: What Investors Should Know,Nvidia has invested in digital twin AI startup MetAI. Here&#39;s what investors need to know about the Taiwanese startup and how it could help Nvidia.
2025-01-15 16:10:02+00:00,"Broadcom's Latest SAN Switch Offers Scalable, Energy-Efficient Solution for Growing Storage Demands","
Broadcom Inc announced new Brocade G710 24-port 64G switch, a top-of-rack SAN switch. It combines cyber-resilient and autonomous technology and is cost-effective for storage solutions. It has low latency, low power consumption, and can support growing environments and demanding applications. Investors can gain exposure to Broadcom through SCHG and SOXX. AVGO stock is up 1.95% at $228.80."
2025-01-15 15:00:12+00:00,Inquiry Into NVIDIA's Competitor Dynamics In Semiconductors &amp; Semiconductor Equipment Industry, 
2025-01-15 14:51:17+00:00,"Intel Plans To Spin Off $5 Billion Venture Capital Segment, Will Remain Anchor Investor","Intel announced plans to separate its VC arm into a standalone fund, giving it more autonomy and ability to attract external capital."
2025-01-15 14:25:54+00:00,"Taiwan Semi, Samsung, Intel May Face Stricter US Rules on Chip Exports to China Over Security Concerns","Taiwan Semiconductor Manufacturing Co (NYSE:TSM), Samsung Electronics (OTC:SSNLF), and Intel Corp (NASDAQ:INTC) could face more "
2025-01-15 14:19:59+00:00,"Top 10 Trending Stocks On WallStreetBets As Of January 15, 2025 (Via Swaggy Stocks)",
2025-01-15 13:32:09+00:00,"NVIDIA Announces First-Ever Quantum Day At GTC 2025, Days After Jensen Huang Said Quantum Computing Is 20 Years Away",Quantum Day will offer sessions exploring both current and future potentials of quantum technology. 
2025-01-15 12:05:56+00:00,"QUBT, QBTS Up 12%, RGTI Gains 3% In Wednesday Premarket: Quantum Computing Stocks Gain Momentum After Microsoft Says 'We Are Right On The Cusp Of Seeing Quantum Computers Solve Meaningful Problems'","Microsoft anticipates that the pace of quantum research and development will accelerate, urging business leaders to act promptly."
2025-01-15 11:03:41+00:00,"US Stocks To Open Higher Ahead Of December Inflation Data: All Eyes On Banking Stocks As JPMorgan, Goldman, Citi, Wells Fargo Report Quarterly Earnings",U.S. stock futures advanced on Wednesday following Tuesday&#39;s mixed close. Futures of all four major indices rose in premarket trade.
2025-01-15 10:06:54+00:00,"New Crypto Accounting Rules Could Accelerate Corporate Bitcoin Adoption, Says CEO Of Leading BTC Miner — Mark-To-Market Standards 'Really Important'",HIVE Digital Technologies Ltd. (NASDAQ:HIVE) co-founder Frank Holmes said that the new cryptocurrency accounting standards will remove barriers to corporate adoption of Bitcoin (CRYPTO: BTC).
2025-01-15 08:44:14+00:00,"Dow Rises Over 200 Points Ahead Of Inflation, Earnings Data: Greed Index Remains In 'Fear' Zone", 
2025-01-15 06:59:31+00:00,"After Nvidia, Semiconductor Trade Groups Oppose  Biden's Chip Export Measures: Rules Threaten To 'Derail Innovation And Economic Growth Worldwide'","U.S. semiconductor trade groups have mounted strong opposition to the President Joe Biden administration&#39;s new chip export restrictions, warning of potential market share losses to global competitors in a private letter to Biden."
2025-01-15 02:25:48+00:00,"Jim Cramer Eyes Quantum Computing Stocks Like Rigetti, Warns Against Super Micro Computer: 'They Are Trying So Hard To Walk It Up Now'",Jim Cramer is steering investors toward quantum computing stocks while expressing concerns about Super Micro Computer Inc. amid its auditor changes.
2025-01-16 21:06:05+00:00,"Nvidia Suffers $10 Billion Setback, AI Chip Sanctions Spell Trouble For 3 ETFs",Nvidia saw several big tech customers defer billions of dollars worth of orders. This development could affect major ETFs.
2025-01-16 19:43:54+00:00,"Analyst Ming-Chi Kuo Posts On X ""TSMC's excellent financial result supports the positive AI trend. However, concerns remain regarding the shipment of Nvidia's GB200 NVL72. It might seem contradictory, but it's not. The key lies in TSMC's advanced nodes, a scarce resource highly sought by all global customers. Therefore, short-term underperformance of a single customer or product isn't likely to significantly impact TSMC's business momentum. On the contrary, TSMC often outperforms the industry average...""",
2025-01-16 18:59:17+00:00,Nvidia Continues Strong Demand for Taiwan Semiconductor's Advanced Packaging Despite Technology Shifts,Nvidia&#39;s demand for advanced packaging from Taiwan Semiconductor remains strong despite evolving technology; plans to use CoWoS-L for Blackwell chip.
2025-01-16 18:29:00+00:00,"Bond Rally Drives Stock Market, Taiwan Semi Results Show AI Demand, Manipulators Having A Heyday With Quantum Computing", 
2025-01-16 17:35:20+00:00,10 Information Technology Stocks With Whale Alerts In Today's Session, 
2025-01-16 15:36:48+00:00,"Meta Boosts Green Energy With New Solar Deal, Supports AI Data Center Growth","Meta Platforms announced procuring 200MW of solar energy from Engie, adding to its renewable power portfolio. Other tech companies also turn to nuclear energy for data center needs."
2025-01-16 15:25:32+00:00,Beamr Is Hosting A Webinar On January 29 With Vice Presidents From Nvidia And Oracle Participating To Discuss The Future Of AI Video; Shares See Volume To The Upside,
2025-01-16 15:01:21+00:00,NVIDIA's Options: A Look at What the Big Money is Thinking, 
2025-01-16 15:00:15+00:00,Inquiry Into NVIDIA's Competitor Dynamics In Semiconductors &amp; Semiconductor Equipment Industry, 
2025-01-16 14:58:59+00:00,Fabrinet's Nvidia Catalyst: Bullish Bet Or Short Seller's Trap?,"Fabrinet is poised for growth due to Nvidia demand, but short interest has also risen. Analysts warn of potential upside surprise."
2025-01-16 14:20:44+00:00,"Top 10 Trending Stocks On WallStreetBets As Of January 16, 2025 (Via Swaggy Stocks)",
2025-01-16 13:59:13+00:00,"""TSMC CEO C. C. Wei Has Dismissed Recent Market Speculation Indicating Nvidia Is Cutting Back Its Demand For CoWoS Packaging Capacity"" - DigiTimes Alert",
2025-01-16 12:53:43+00:00,AI Chip Stocks Gain Momentum On Taiwan Semiconductor Performance;  Biden's Semiconductor Sanctions Kick In,"AI chip stocks rally on news of Taiwan Semiconductor&#39;s upbeat quarterly report and new US regulations on chip exports to China, impacting companies like Nvidia and Apple."
2025-01-16 11:27:55+00:00,"US Stocks Could Open Higher After Big Banks Report Strong Earnings: Mag 7 Now Account For A Third Of S&P 500's Market Capitalization, Raising Alarms","U.S. stock futures were mixed on Thursday, futures of S&amp;P 500, Nasdaq 100 and Dow Jones were higher, whereas Russell 2000 was trading lower."
2025-01-16 11:13:28+00:00,"Quantum Computing Stocks Continue Their Wild Surge In Thursday Premarket: QUBT Up 15%, QBTS Climbs 9%, RGTI Gains Over 3%","Quantum computing stocks continued their upward momentum in Thursday&#39;s premarket, building on Wednesday&#39;s strong gains. The surge followed Microsoft Corp.&#39;s (NASDAQ: MSFT) call for businesses to embrace a &#34;quantum-ready&#34; future by 2025, signaling growing optimism around the sector&#39;s potential."
2025-01-16 10:42:24+00:00,Jim Cramer Quips About Joe Biden's TSMC Chips Sanction As Nvidia Supplier Beats Q4 Estimates,Jim Cramer endorsed Taiwan Semiconductor Manufacturing Co&#39;s strong Q4 while taking a jibe at Joe Biden&#39;s sanctions on the chipmaker.
2025-01-16 10:36:37+00:00,"Taiwan Semiconductor Q4 Earnings: 3nm and 5nm Nodes Lead Topline Growth, Expands Margins, Issues Strong Q1 Outlook","Taiwan Semiconductor&#39;s quarterly results beat forecasts, driven by demand for advanced chips for AI applications. Revenue guidance for Q1 above consensus."
2025-01-16 10:04:13+00:00,Microsoft Launches 365 Copilot Chat For Business With Pay-As-You-Go Plan,"Microsoft has introduced a pay-as-you-go plan for its AI-powered 365 Copilot Chat, making workflow automation tools powered by OpenAI&#39;s GPT-4 more accessible and affordable for businesses with flexible or smaller-scale needs."
2025-01-17 22:09:28+00:00,NVIDIA Says Implementation Of Additional Due Diligence Measures For Advanced Computing IC Rule Not Expected To Impact Ops/Sales To China; Co Is An Approved IC Designer,
2025-01-17 19:15:35+00:00,"Intel Stock Gains On Speculative Buyout Report, Details Remain Unclear","Intel stock gains on reports of acquisition interest, but has struggled in past year. CFO acknowledges potential sale of divisions. "
2025-01-17 18:01:44+00:00,"CNBC Halftime Report Final Trades: NVIDIA, Robinhood Markets, Snowflake, CRH PLC",
2025-01-17 17:35:17+00:00,10 Information Technology Stocks With Whale Alerts In Today's Session, 
2025-01-17 16:51:31+00:00,What's Going On With Qorvo Shares Friday?,Qorvo stock is moving higher on Friday following a Wall Street Journal report revealing that activist investor Starboard Value has acquired a 7.7% stake in the company.
2025-01-17 15:24:27+00:00,"Top 10 Trending Stocks On WallStreetBets As Of January 17, 2025 (Via Swaggy Stocks)",
2025-01-17 15:00:15+00:00,In-Depth Analysis: NVIDIA Versus Competitors In Semiconductors &amp; Semiconductor Equipment Industry, 
2025-01-17 14:57:30+00:00,Nvidia To Rally Around 31%? Here Are 10 Top Analyst Forecasts For Friday, 
2025-01-17 13:07:38+00:00,"Quantum Computing Stocks Are 'Totally Divorced From Reality,' Says Analyst Flagging Inflated Valuations",Popular quantum computing stocks have been surging following a slew of positive news flow but this valuation metric shows that the stocks could be over expensive.
2025-01-17 14:47:43+00:00,Nvidia Unveils AI Safety Tools to Boost Enterprise Trust; CEO Jensen To Miss Trump Inauguration,Nvidia launches NeMo Guardrails to help companies improve AI applications. Big Tech leaders to attend President-elect Trump&#39;s inauguration.
2025-01-17 11:13:03+00:00,"US Stocks Likely To Open Higher Ahead of Trump's Inaugration: All 11 Sectors To Report Growing Profits In 2025, Says Analyst","U.S. stock futures were trading higher on Friday, recovering from the previous day&#39;s losses. Futures across all major indices showed gains."
2025-01-17 13:14:09+00:00,Sector Crosscurrents Drive Potential Opportunities In Direxion's Tech Bull And Bear 3X ETFs, 
2025-01-17 13:13:42+00:00,"Barclays Maintains Overweight on NVIDIA, Raises Price Target to $175",
2025-01-17 12:01:50+00:00,"Sony Cancels Two Live-Service Games, Stays Committed to Long-Term Monetization","PlayStation cancels unannounced live-service projects at Bend Studio and Bluepoint Games. Sony remains invested in live-service games and sold 3.8M PS5 units in Q2. Gaming industry faces challenges, including studio closures."
2025-01-17 10:28:00+00:00,"RGTI Stock Offers 'Highest Return Potential' Among Quantum Computing Peers, Says Investor: Rigetti Computing Has Returned Over 860% In The Last Months",The spotlight on Rigetti Computing comes amid heightened interest in quantum computing stocks.
2025-01-17 08:21:16+00:00,"S&P 500 Ends Three-Session Win Streak Amid Decline In Apple, Nvidia: Greed Index Remains In 'Fear' Zone","U.S. stocks ended lower as tech shares recorded losses, while Morgan Stanley and Bank of America beat earnings expectations."
2025-01-17 05:54:22+00:00,Qorvo Soars 7% After Hours As Activist Investor Starboard Reportedly Takes Stake In Semiconductor Company,"Activist investor Starboard Value LP has reportedly acquired a 7.7% stake worth approximately $500 million in Qorvo Inc. on Thursday, targeting the struggling semiconductor manufacturer for potential operational changes."
2025-01-17 03:47:34+00:00,Jim Cramer Questions Nvidia's Trading Pattern Amid Positive TSMC Earnings And Biden's China Export Regulations,"NVIDIA Corp. is facing renewed market scrutiny as Jim Cramer questioned the stock&#39;s trading pattern on Thursday, amid growing concerns over China sanctions and positive earnings from key supplier Taiwan Semiconductor Manufacturing Co."
2025-01-17 02:52:41+00:00,"Bitcoin, Ethereum, Dogecoin Steady As Market Expects Trump's Pro-Crypto Bonanza: Analyst Says BTC Could Hit All-Time High If It Breaks This Resistance",Leading coins remained steady on Thursday amid reports that President-elect Donald Trump may announce several pro-cryptocurrency measures after being sworn in.
2025-01-18 20:30:36+00:00,Billionaire Stanley Druckenmiller: Selling This AI Stock Was a 'Big Mistake',Hedge fund manager Stanley Druckenmiller regrets the decision to sell his fund&#39;s stake in Nvidia.
2025-01-19 23:10:43+00:00,"IonQ, H&E Equipment Services And ImmunityBio Are Among Top Mid Cap Gainers Last Week (Jan 13-Jan 17): Are The Others In Your Portfolio?","Explore this week&#39;s top-performing mid-cap stocks, including H&amp;E Equipment Services&#39; impressive 100.59% surge following an acquisition announcement by United Rentals. Discover why stocks like SEMrush and Blueprint Medicines also experienced significant gains, impacting investment portfolios positively."
2025-01-19 23:06:33+00:00,Trump Said He Will Use Emergency Powers To Allow People To Build Big AI Plants,
