date,headline,summary
2025-01-19 16:41:37+00:00,"Nvidia's $10 Billion Setback, OpenAI Controversy, And Microsoft's AI Chat Launch: This Week In Artificial Intelligence","From potential sanctions shaking up the semiconductor sector to controversies surrounding AI companies, the news has been abuzz with developments that could have far-reaching implications."
2025-01-19 14:15:36+00:00,"Consumer Tech News (Jan 13-17): Meta Plans Performance Based Job Cuts, Youtuber MrBeast Aims To Buy TikTok To Prevent Shutdown & More","Washington state sues T-Mobile for cybersecurity negligence, Trump considers TikTok ban, MrBeast seeks to acquire app, Apple&#39;s China market share drops, and Microsoft launches AI chat service."
2025-01-20 17:35:11+00:00,10 Information Technology Stocks With Whale Alerts In Today's Session, 
2025-01-20 15:01:57+00:00,In-Depth Analysis: NVIDIA Versus Competitors In Semiconductors &amp; Semiconductor Equipment Industry, 
2025-01-20 05:31:18+00:00,"Nvidia Executive Contrasts Elon Musk's Optimism On Fully Autonomous Cars, Says Milestone Won't Be Achieved Until Next Decade: 'It's Super Hard'","Autonomous vehicles won&#39;t be ready for widespread deployment until &#34;well into the next decade,&#34; according to NVIDIA Corp. automotive chief Ali Kani, even as major tech companies accelerate their investments in self-driving technology."
2025-01-21 19:44:56+00:00,"Nvidia, AI Stocks Rise As Trump Announces $500 Billion Stargate AI Infrastructure Venture","Shares of NVIDIA Corporation (NASDAQ: NVDA) and other AI stocks such as Dell Technologies Inc. (NYSE: DELL), Oracle Corporation (NYSE: ORCL) and Arm Holdings plc (NASDAQ: ARM) are trading higher Tuesday buoyed by reports of a major private sector investment in artificial intelligence infrastructure. "
2025-01-21 17:38:17+00:00,10 Information Technology Stocks Whale Activity In Today's Session, 
2025-01-21 17:20:26+00:00,"Trump Reverses Biden's AI Policies On Day 1: What It Means For Tech Giants Nvidia, AMD, Alphabet",President Donald Trump on Monday revoked former President Joe Biden&#39;s comprehensive executive order on artificial intelligence as part of his first actions in office. 
2025-01-21 15:00:17+00:00,Comparative Study: NVIDIA And Industry Competitors In Semiconductors &amp; Semiconductor Equipment Industry, 
2025-01-21 13:50:57+00:00,"Huawei Wants To Take Nvidia's Place In AI In China, Shifts Focus to Inference Over Training",Huawei eyes larger share of domestic AI chip market by retrofitting AI models trained on Nvidia GPUs and helping companies make the two systems compatible.
2025-01-21 13:50:50+00:00,"Nvidia, Robinhood, Snowflake And A Basic Materials Stock On CNBC's 'Final Trades'","CNBC Halftime Report analysts share their final trades, featuring bullish calls on NVIDIA, Robinhood, Snowflake, and CRH, along with recent analyst ratings and regulatory updates."
2025-01-21 12:11:43+00:00,"US Stocks Set To Open On A Positive Note As Trump's Second White House Term Kicks Off: Tesla, Apple, Netflix Among Stocks In Focus",U.S. stocks could open on a positive note on Tuesday after Donald Trump&#39;s inauguration as the 47th President of the U.S. on Monday.
2025-01-21 06:04:46+00:00,"Nasdaq Surges 1.5% Amid Gains In Tesla, Nvidia: Investor Sentiment Improves, But Greed Index Remains In 'Fear' Zone", 
2025-01-21 04:55:17+00:00,"Nancy Pelosi Sells Nvidia, Apple And Loads Up On Google-Parent Alphabet And Amazon Calls","Former House Speaker Nancy Pelosi has executed a series of significant technology stock trades valued at over $30 million, according to recent congressional disclosure reports, while recovering from a hip injury sustained during an official trip to Luxembourg."
2025-01-21 01:29:23+00:00,"Nvidia, Apple-Supplier TSMC Halts Production As 6.4 Magnitude Earthquake Strikes Taiwan","A 6.4 magnitude earthquake struck southern Taiwan early Tuesday, forcing Taiwan Semiconductor Manufacturing Co. to evacuate facilities in a region critical to global chip supply, marking the second significant seismic event to impact semiconductor operations in recent months."
2025-01-22 21:23:20+00:00,"S&P 500 Hits Fresh Records At 6,100: Strong Earnings, Trump's AI Wager Fuel Bull Run","Market surges on AI Stargate initiative &amp; strong earnings. S&amp;P 500 hits record high of 6,100 points, led by tech giants &amp; semiconductor stocks."
2025-01-22 18:52:43+00:00,"Himax To Gain Big As TSMC, Nvidia and AMD Advance Silicon Photonics and COUPE Tech: Analyst","Kuo predicts Himax as potential supplier for Taiwan Semiconductor&#39;s Compact Universal Photonic Engine development, with revenue reaching $2.4B in 2028."
2025-01-22 18:13:49+00:00,"Taiwan Semiconductor's Capex Plans Boost These Chip Stocks, Jim Cramer Says","Jim Cramer calls out market reaction to Taiwan Semiconductor&#39;s strong earnings and guidance, boosting related companies&#39; stocks."
2025-01-22 18:11:39+00:00,"Chipmakers Rally On AI Stargate Bet, Netflix Soars, Bitcoin Falters As Trump Keeps Quiet On Crypto: What's Driving Markets Wednesday?","Tech stocks enjoyed a surge Wednesday, driven by a sharp rise in semiconductor shares after President Donald Trump, OpenAI&#39;s Sam Altman, Oracle Corp."
2025-01-22 17:35:11+00:00,10 Information Technology Stocks With Whale Alerts In Today's Session, 
2025-01-22 17:22:37+00:00,Will SoundHound AI Stock Get A Boost From Project Stargate?,"SoundHound AI shares soared on Tuesday as AI-related stocks got a boost after President Donald Trump announced Project Stargate, a massive $500 billion AI infrastructure investment initiative featuring Oracle, OpenAI, Nvidia and SoftBank Capital."
2025-01-22 16:51:08+00:00,Trump's $500 Billion Stargate AI Plan Puts 3 ETFs In Focus,"Trump announced a $500 billion AI infrastructure initiative with tech CEOs, leading to stock gains. AI ETFs like Invesco Top QQQ poised to capitalize."
2025-01-22 15:53:57+00:00,Cadence Announces MediaTek's 30% Productivity Boost Using Virtuoso Studio And 6X Performance Gain With Spectre X On NVIDIA GPUs For 2nm Design Flow,
2025-01-22 15:53:11+00:00,"Stargate Adds Fuel To AI Frenzy, Chinese Stocks Sink On Trump Tariff Talk","



To gain an edge, this is what you need to know today."
2025-01-22 15:38:38+00:00,"Benzinga Market Summary: AI Stocks Rise On Stargate AI Investment, Netflix Rises On Strong Earnings And Price Hike, 10-Year Treasury Yield Rises",
2025-01-22 15:00:47+00:00,Competitor Analysis: Evaluating NVIDIA And Competitors In Semiconductors &amp; Semiconductor Equipment Industry, 
2025-01-22 14:16:31+00:00,Tech Stocks Rise After Trump Announces AI Infrastructure Investment,Shares of AI-related tech companies are trading higher Wednesday after U.S. President Donald Trump announced a $500 billion AI infrastructure investment called Project Stargate.
2025-01-22 13:28:07+00:00,Oracle's AI Moonshot: Why Project Stargate Could Propel ORCL Stock Higher,"Oracle&#39;s stock surges 8.51% after Trump announces $500B AI initiative, solidifying its role as a key AI provider. CEO Ellison&#39;s stake also rises."
2025-01-22 11:02:59+00:00,"US Stocks Likely To Open Higher As President Trump Announces $500 Billion AI Project: Oracle, Netflix, Nvidia Among Top Stocks To Watch","U.S. stocks could open on a positive note on Wednesday, continuing to rally after Donald Trump&#39;s inauguration as the 47th President of the U.S. on Monday."
2025-01-22 10:42:15+00:00,"Elon Musk Says Project Stargate Doesn't 'Actually Have The Money' After Trump Announces $500 Billion AI Investment Led By SoftBank, Oracle And OpenAI", 
2025-01-22 05:09:52+00:00,"Martin Shkreli Calls IonQ And Rigetti 'Best Shorts' Despite Recent Stock Gains, Cites Offline Quantum Systems",Former hedge fund manager Martin Shkreli called quantum computing stocks IonQ and Rigetti Computing &#34;one of the best shorts&#34; of his career.
2025-01-22 03:52:43+00:00,Oracle's Larry Ellison Says Cancer Vaccine Tailored In 48 Hours Could Soon Be A Reality As Trump Announces $500 Billion AI Investment,Larry Ellison unveiled plans for an AI-driven cancer vaccine system that could deliver personalized treatments within 48 hours.
2025-01-23 21:27:37+00:00,Micron Technology Shares Are Falling: What's Going On?,Shares of Micron Technology are trading lower Thursday following remarks from a supplier to Nvidia Corp.
2025-01-23 19:16:24+00:00,"Tesla Lost $15 Billion In Brand Value In 2024, Report Says: Did Elon Musk's Political Push Hurt EV Giant?","Tesla&#39;s brand value fell in 2024 and the company drops down the top 100 list from Brand Finance, thanks in part to Elon Musk&#39;s political push."
2025-01-23 17:36:12+00:00,10 Information Technology Stocks Whale Activity In Today's Session, 
2025-01-23 15:00:17+00:00,Market Analysis: NVIDIA And Competitors In Semiconductors &amp; Semiconductor Equipment Industry, 
2025-01-23 14:05:51+00:00,"Tesla, Nvidia ETFs In The Works To Tap Rising Interest In Same-Day Stock Options","Matt Tuttle plans new ETFs targeting retail investor favorites like Nvidia, Tesla, and MicroStrategy. Daily 0DTE trading on individual stock options expected to launch later this year."
2025-01-23 12:59:20+00:00,PLTR Stock Is Up 166% In Last 6 Months. Now Dan Ives Sees Room For 17% More Growth: 'Our Recent Checks And Growing Confidence…Is Key To The Bull Thesis',Wedbush Securities has raised its price target on Palantir Technologies citing the company&#39;s growing confidence in its &#34;AI strategy&#34;.
2025-01-23 09:43:26+00:00,TikTok-Parent ByteDance Plans $12 Billion AI Chip Investment In 2025 To Bolster Global AI Ambitions Amid US Export Controls: Report,"ByteDance plans to invest over $12 billion in AI infrastructure by 2025, focusing on AI chip acquisitions and overseas model training."
2025-01-23 02:29:58+00:00,"Bitcoin, Ethereum, Dogecoin Drop Amid Stock Rally, Cooling Investor Sentiment On Trump: Analyst Projects BTC At $150K If History Repeats","Leading cryptocurrencies dipped on Wednesday, diverging with the stock market rally, as the market expects more from the new Donald Trump administration."
2025-01-23 02:19:47+00:00,Apple's $510 Billion Market Cap Drop Opens Door For Nvidia To Reclaim World's Largest Company Title Amid iPhone Maker's China Struggles,"Nvidia Corp has reclaimed its position as the world&#39;s largest company after Apple Inc. experienced a dramatic $510 billion market capitalization decline over three weeks, according to analysis from The Kobeissi Letter."
2025-01-24 18:46:20+00:00,Price Over Earnings Overview: NVIDIA, 
2025-01-24 17:43:50+00:00,What's Going On With NVIDIA Stock Friday?,NVIDIA shares are moving lower on Friday following soft guidance from Texas Instruments.
2025-01-24 17:36:31+00:00,10 Information Technology Stocks With Whale Alerts In Today's Session, 
2025-01-24 16:45:42+00:00,Looking At NVIDIA's Recent Unusual Options Activity, 
2025-01-24 15:00:13+00:00,Comparative Study: NVIDIA And Industry Competitors In Semiconductors &amp; Semiconductor Equipment Industry, 
2025-01-24 14:37:57+00:00,"Broadcom Powers Solidigm's High-Capacity SSDs, A Key Driver for AI and Data-Intensive Growth",Solidigm extends deal with Broadcom to use high-capacity SSD controllers for AI and data-intensive workloads. Broadcom stock surged 92% in the last 12 months.
2025-01-24 14:34:34+00:00,Verizon AI Connect Unleashes Next-Level Business Solutions - What's On The Cards?,"Verizon Business has unveiled Verizon AI Connect, offering a suite of solutions to scale artificial intelligence operations. This initiative aims to meet the rising demand for real-time AI tasks."
2025-01-24 08:57:54+00:00,"Nvidia, Microsoft, Or Oracle: Which Stock Among These Stargate AI Project Beneficiaries Are The Least Expensive To Own?","After Donald Trump announced the $500 billion Stargate project, we examine the U.S.-listed beneficiaries which are least expensive to own."
2025-01-25 05:41:53+00:00,"Mark Zuckerberg's $65 Billion AI Bet Benefits Nvidia And Other Players, Says Top Analyst, But Warns Market Bull Run Will 'End In A Spectacular Bubble Burst'",Deepwater Asset Management&#39;s Gene Munster says Meta Platform Inc.&#39;s (NASDAQ: META) plans to invest up to $65 billion this year to expand its AI infrastructure will benefit Nvidia and other hardware players.
2025-01-27 23:06:17+00:00,"7 AI Infrastructure Stocks Plunge Over 20%, Outpace Semiconductor Rout As DeepSeek Upends Investment Landscape","The launch of DeepSeek affects the AI boom including the power, cooling and data center giants that once rode the AI euphoria, which now have single-day losses exceeding 20%."
2025-01-27 22:02:28+00:00,Crypto-Linked Stocks Are Falling Today: What's Going On?,"Shares of crypto-linked stocks like MARA Holdings and Coinbase Global Inc. traded lower Monday due to a sharp decline in Bitcoin prices, which dropped below $100,000 amid broader market uncertainty."
2025-01-27 21:45:50+00:00,"DeepSeek AI Model Sends Shockwaves Through Nvidia, Slams ETFs","DeepSeek, a China-based AI startup, launched a new model that poses a challenge to U.S. competitors, including Nvidia&#39;s core business."
2025-01-27 20:54:25+00:00,Nvidia Sinks Below 200-Day Moving Average For First Time In Two Years As DeepSeek Sparks Historical Technical Reset,"Nvidia broke below its 200-day moving average on Monday after the launch of DeepSeek, a Chinese open-source AI platform."
2025-01-27 20:25:01+00:00,Options Corner: Tech Sector Fallout Opens An Opportunity For Nvidia With One Critical Caveat,"While Nvidia stock appears to be a discount amid the DeepSeek AI threat, investors will want to note an important caveat."
2025-01-27 19:22:03+00:00,"Traders Want The Fed To Tame Market Volatility, Yet Trump-Powell Interest Rate Fight Is Just Beginning","The Federal Reserve&#39;s first meeting of 2025 comes at a moment of elevated uncertainty, as a brutal tech sell-off erased trillions in market value and fresh tensions between President Donald Trump and Fed Chair Jerome Powell may threaten to shake interest rate policy in the months ahead."
2025-01-27 19:12:22+00:00,"Nvidia Spokesperson Says DeepSeek's Work Shows How New Models Can Be Created, Leveraging Widely-Available Models And Compute That Is Fully Export Control Compliant",
2025-01-27 18:18:42+00:00,"Tech Stocks Tumble On AI Nightmare, Nvidia Eyes Worst Day Since March 2020, Bitcoin Drops Below $100,000: What's Driving Markets Monday?","A wild selloff rattled tech stocks on Monday, striking at the heart of AI optimism as China’s DeepSeek startup unveiled an open-source large language model platform that outperforms OpenAI’s ChatGPT at a "
2025-01-27 18:12:58+00:00,"Bitcoin, Ethereum, Solana Crash — Here's Why China's Low-Cost AI Model DeepSeek May Be To Blame","Chinese AI startup DeepSeek&#39;s $6 million AI model has rattled global global markets, with experts warning it signals a major shift in AI competition."
2025-01-27 17:59:27+00:00,IronHold Capital CIO Reveals Trends Hedge Funds Track: 4 ETFs To Watch,"Hedge funds offer valuable insights for retail investors. ETFs based on bullish sectors such as autos, homebuilding, mining and AI can capitalize on these themes."
2025-01-27 17:47:17+00:00,DeepSeek R1 Vs. OpenAI: What Consumers Need To Know About AI's Latest Challenger,"DeepSeek R1&#39;s emergence as a cost-effective AI model is intensifying competition with established players like OpenAI and Meta, but its long-term adoption hinges on enterprise acceptance and infrastructure support."
2025-01-27 17:35:39+00:00,10 Information Technology Stocks With Whale Alerts In Today's Session, 
2025-01-27 17:19:09+00:00,Jensen Huang Mania Mirrors Taylor Swift: People Are Camping Outside Retailers For Nvidia 5000 Series GPUs,People are camping out in the cold to be the first to buy new Nvidia 5000 Series GPUs. A look at how Nvidia is entering Taylor Swift territory.
2025-01-27 17:16:40+00:00,"Trump's Executive Orders Fuel Tech, Weaken Energy Stocks In His First Week: Immigration, Tariff Reforms On Cards But Experts Say 'Don't Play Politics With Your Portfolio' (CORRECTED)","Donald Trump&#39;s first week focused on four key areas, driven by macroeconomic considerations: technology, tariffs, energy, and immigration."
2025-01-27 16:21:29+00:00,"DeepSeek Says Due To Large-Scale Malicious Attacks On DeepSeek's Services, We Are Temporarily Limiting Registrations To Ensure Continued Service",
2025-01-27 16:14:02+00:00,"China Appears To Leapfrog U.S. In AI, Investors Selling Nvidia And Buying Chinese AI Stocks",Investors should be somewhat skeptical about DeepSeek&#39;s claims given its China origin and heavy censoring by the Chinese Government.
2025-01-27 16:07:49+00:00,"DeepSeek Sparks AI Carnage As Magnificent Seven, Broadcom Lose Nearly $900 Billion In Value: Why This Expert Is Still 'Bullish' On US Tech","China&#39;s DeepSeek R1 threatens U.S. tech dominance as investors fear lower-cost AI models. $900B wiped from markets in 30 mins, some analysts remain bullish."
2025-01-27 16:02:48+00:00,Stock Of The Day: Nvidia Breaks Support After DeepSeek AI Disruption,Shares of NVIDIA (NVDA) may continue to move lower. The stock has broken support and this type of price action tends to be bearish.
2025-01-27 15:40:51+00:00,VCI Global Expands AI Infrastructure With $25M Investment,"VCI Global Limited (NASDAQ: VCIG) is making waves as its subsidiary, AI Computing Center Malaysia (AICC), secures advanced AI infrastructure from Super Micro Computer, Inc. (NASDAQ: SMCI). This $25 million investment includes 64 Supermicro servers with NVIDIA H200 GPUs."
2025-01-27 15:18:04+00:00,"China's DeepSeek AI Rattles Tech Stocks, Analyst Ives Says Market Plunge 'Golden Buying Opportunity'","Chinese AI startup DeepSeek&#39;s LLM launch caused tech stock sell-off, but analyst Daniel Ives sees it as a buying opportunity &amp; no threat to AI revolution."
2025-01-27 15:07:14+00:00,"Market Clubhouse Morning Memo - January 27th, 2025 (Trade Strategy For SPY, QQQ, AAPL, MSFT, NVDA, GOOGL, META and TSLA)","Here&#39;s a trade strategy for SPY, QQQ, AAPL, MSFT, NVDA, GOOGL, META and TSLA"
2025-01-27 15:00:46+00:00,Analyzing NVIDIA In Comparison To Competitors In Semiconductors &amp; Semiconductor Equipment Industry, 
2025-01-27 14:54:04+00:00,The Sixteen Trillion Dollar Question,Should you hedge Nvidia against a possible 20% drop in because of DeepSeek-inspired Market Turmoil?
2025-01-27 14:39:11+00:00,"Benzinga Market Summary: Nasdaq Falls As Tech Stocks Drop On AI Competition Concerns From China's DeepSeek, Tariff Concerns Also Weigh On Market Sentiment",
2025-01-27 14:25:37+00:00,"Top 10 Trending Stocks On WallStreetBets As Of January 27, 2025 (Via Swaggy Stocks)",
2025-01-27 14:14:55+00:00,"DeepSeek Jitters Shatter US Tech Stocks, Wipe Out $1.2 Trillion On Wall Street: Analyst Eyes Four Chinese Giants Set To Benefit",Chinese open-source AI platform DeepSeek R1 sparks investor fears over competition and capital allocation into high-cost American firms.
2025-01-27 14:06:55+00:00,"Cantor Fitzgerald Reiterates Overweight on NVIDIA, Maintains $200 Price Target",
2025-01-27 13:58:22+00:00,Super Micro Stock Nosedives As DeepSeek AI Threat Rattles Investors,"Super Micro&#39;s stock plunges over 10% on AI competition from China&#39;s DeepSeek. With looming Nasdaq deadline, SMCI needs lifeline to regain highs."
2025-01-27 13:02:51+00:00,Social Media Drama Shines Spotlight On Direxion's Meta Platforms-Focused Bull And Bear Funds, 
2025-01-27 12:20:48+00:00,Market-Moving News for January 27th,
2025-01-27 11:44:36+00:00,US Stock Futures Tumble As DeepSeek Buzz Jolts Big Tech: Expert Says The Chinese AI Model Is Yet To Prove Its Viability At Lower Cost In Long Term,"U.S. stock futures dropped sharply on Monday after China released DeepSeek, an AI model that demonstrates high performance at a lower cost."
2025-01-27 11:19:34+00:00,"Satya Nadella Said 'We Should Take Development Out Of China Very, Very Seriously.' Now, DeepSeek's R1 Has Emerged As A ChatGPT Killer, Outperforming OpenAI With 50x Lower Costs: Here's More","days after he said the China threat needs to be taken seriously, DeepSeek, a China-based AI startup, has beaten OpenAI with 97% less computing power and 50 times cheaper prices."
2025-01-27 10:51:04+00:00,Verizon Launches AI Connect As McKinsey Predicts That 60-70% Of AI Workload Will Shift From Training To Inferencing By 2030,"As McKinsey highlights a significant shift in how artificial intelligence will be used in future, Verizon Communications launches AI Connect."
2025-01-27 09:32:18+00:00,"S&P 500 Retreats After Hitting Fresh Records: Investor Sentiment Improves, But Fear & Greed Index Remains In 'Neutral' Zone","Market sentiment improved, but remained neutral on Friday. US stocks closed lower, with some tech stocks falling."
2025-01-27 09:30:51+00:00,"Nvidia, AMD, Broadcom, SMCI, TSMC And Other Tech Giants Lead Monday Pre-Market Selloff As Nasdaq 100 Futures Plummet Over 650 Points Amid Reports Of Chinese AI Startup DeepSeek Overtaking ChatGPT","Major technology stocks plunged in Monday&#39;s pre-market trading after Chinese artificial intelligence startup DeepSeek unveiled an AI model that reportedly matches OpenAI&#39;s capabilities at a fraction of the cost, threatening U.S. technological leadership."
2025-01-27 04:32:26+00:00,Nvidia Stock Slides Overnight On Robinhood As China's DeepSeek Sparks Doubts Over GPU Spending Frenzy — Chamath Palihapitiya Highlights Report Indicating AI Holy Grail Cracked,"Nvidia shares fell 3.12% after China&#39;s DeepSeek unveiled an AI model that delivers cutting-edge performance at a fraction of the cost, raising concerns over the necessity of massive GPU-related spending."
2025-01-28 23:30:08+00:00,Magnificent 7 Earnings Ahead: 3 ETFs To Ride The Wave,"Earnings season in full swing, attention on tech giants known as Magnificent 7: 3 ETFs to consider."
2025-01-28 21:47:15+00:00,EXCLUSIVE: Will DeepSeek Hurt Magnificent 7 Stocks Valuation? 57% Say This,The majority of the Magnificent 7 stocks were hit Monday on concerns of the emergence of DeepSeek. A Benzinga reader poll predicts what happens next.
2025-01-28 21:34:26+00:00,Options Corner: Broadcom's Discount Entices But Watch For Stormy Clouds Ahead,"Although statistical trends favor bullish traders grabbing Broadcom&#39;s big discount, they should be aware of a looming technical risk."
2025-01-28 21:06:10+00:00,AMD Gets A Downgrade And It's Not DeepSeek Related,"Reitzes downgrades AMD to Hold, lowers price target to $129. Cautious on x86 servers &amp; PCs due to Nvidia competition. Slashes estimates below consensus."
2025-01-28 20:00:32+00:00,42 Analysts Assess NVIDIA: What You Need To Know, 
2025-01-28 19:28:32+00:00,"Nvidia Positioned For $400 Billion AI Boom With Advanced GPUs, New Product Launches Driving Revenue Growth, Say Analysts","Analysts rerate Nvidia reflecting its position as industry leader in AI adoption, despite recent stock drop."
2025-01-28 19:10:48+00:00,"Tech Rebounds After Black Monday, Nvidia Rallies 6%, GM Plummets: What's Driving Markets Tuesday?","Tech stocks attempted a rebound after Monday&#39;s devastating crash triggered by DeepSeek, as investors show interest in dip-buying the hardest-hit names."
2025-01-28 18:03:40+00:00,Fed Set To Signal No Rush To Cut Rates As Wall Street Awaits Policy Clarity,"Fed expected to keep rates steady, but Wall Street desperate for clarity on when next cut will come. Markets hoping for a dovish signal, but Powell may not deliver. Odds of two cuts in 2025 at 93%, with $4 payout for single cut and $6 for no cuts."
2025-01-23 02:36:43+00:00,"Nvidia Supplier SK Hynix Soars 102% In Revenue, But Stock Drops Despite AI Memory Boom","SK hynix Inc. reported financial results for 2024, with revenues surging 102% to 66.19 trillion won ($46.34 billion), driven by explosive demand for artificial intelligence memory products. "
2025-01-28 11:25:56+00:00,Not Just DeepSeek - Alibaba Unveils AI Model To Rival OpenAI's Operator,"Alibaba&#39;s cloud unit released Qwen2.5-VL AI model which beats OpenAI in various evaluations. Chinese tech stocks up, US stocks down due to AI tech embargo."
2025-01-28 17:35:11+00:00,10 Information Technology Stocks Whale Activity In Today's Session, 
2025-01-28 17:20:54+00:00,"Morgan Stanley Maintains Overweight on NVIDIA, Lowers Price Target to $152",
2025-01-28 16:10:26+00:00,"Tigress Financial Upgrades NVIDIA to Strong Buy, Raises Price Target to $220",
2025-01-28 15:53:13+00:00,Stock Of The Day: Time For Some Profit-Taking In Accenture?,There is a good chance there is some profit-taking in Accenture (ACN). The shares are overbought and at resistance.
2025-01-28 15:48:16+00:00,Jensen Huang Loses $20B In Wealth: How DeepSeek Hit Nvidia Stock And World's Richest People,Jensen Huang and Nvidia both saw their values hit hard Monday as investors digested the impact of Chinese AI company DeepSeek.
2025-01-28 15:22:32+00:00,"Benzinga Market Summary: Tech Stocks Rebound Following Monday's Selloff, GM Warns Of Policy Uncertainty, Trump Admin Suggests Plans For Further Tariffs",
2025-01-28 15:17:16+00:00,"Wall Street Comes To Nvidia's Defense After Biggest Loss Ever, Many Momos Wiped Out","



To gain an edge, this is what you need to know today."
2025-01-28 15:00:38+00:00,Inquiry Into NVIDIA's Competitor Dynamics In Semiconductors &amp; Semiconductor Equipment Industry, 
2025-01-28 14:41:40+00:00,"Taiwan Semiconductor Stock Rebounds After Selloff, US-Taiwan Chip Partnership Still Faces Tariff Threats", TSMC stock saw redemption after Monday selloff. Taiwan economy ministry says US-Taiwan semiconductor business is a win-win model despite Trump&#39;s tariff threats. Taiwan home to Apple and Nvidia. TSM stock up 3.23% premarket.
2025-01-28 14:24:30+00:00,DeepSeek's Low-Cost Model Reshapes AI Landscape: Experts Predict Shift To 'Application Layer',AI boom faces scrutiny as Chinese firm DeepSeek&#39;s model challenges U.S. industry. Investors question high infrastructure costs and returns.
