date,headline,summary
2025-01-06 20:38:22+00:00,"Benzinga Market Summary: Bitcoin Rises, Trudeau To Resign As Liberal Party Leader, Tech Stocks Rise Amid CES 2025 And Microsoft AI Investment Plans",
2025-01-06 19:53:22+00:00,"Watching ZJK Industrial; Shares Spike Higher As Traders Circulate X Post ""$ZJK $NVDA BIG ANNOUNCEMENT IMMINENT! ZJK is proud to partner with NVIDIA! #AIRevolution #CES2025""",
2025-01-06 19:30:20+00:00,"Nvidia Soars, AMD Stalls: AI Race Heats Up At CES 2025",Semiconductor showdown set as Nvidia and AMD face off at CES 2025. Nvidia dominates with AI growth while AMD struggles to catch up. All eyes on Blackwell chip reveal.
2025-01-06 18:54:20+00:00,"AMD and Nvidia Overtake Intel in Key Markets, Challenging Its Leadership","Intel facing crisis as rivals snatch market share, leading to plunging stock, lost opportunities in data center, gaming, and laptops."
2025-01-06 18:45:57+00:00,"Wall Street Rallies, Chipmakers Soar Ahead Of Nvidia's Huang Speech, Bitcoin Reclaims $100,000: What's Driving Markets Monday?","Wall Street is in full risk-on mode, as traders eagerly snap up technology stocks, particularly semiconductors, ahead of Nvidia Corp. (NASDAQ:NVDA) CEO Jensen Huang‘s speech later on Monday at the Consumer Electronics Show "
2025-01-06 05:37:43+00:00,"Israel Englander's Millennium Management Dumps Nvidia, Loads Up On Broadcom — Here's What The $70 Billion Hedge Fund Sees","Israel Englander&#39;s Millennium Management has made sweeping adjustments to its portfolio, including a remarkable 91,046.15% increase in Alibaba Group Holding Ltd. (NYSE:BABA) call options and a 94.69% increase in Broadcom Inc."
2025-01-06 17:55:57+00:00,"AI, Quantum, And Robotics in Focus – All Eyes On Nvidia CEO Keynote", 
2025-01-06 17:53:51+00:00,"The Final Investment Frontier: If You Were Late To AI, You Can Be Early To Space", 
2025-01-06 17:35:11+00:00,10 Information Technology Stocks Whale Activity In Today's Session, 
2025-01-06 17:10:25+00:00,"Nvidia 5000 Series, Product Updates Make It Top Semiconductor Pick Ahead Of Jensen Huang's CES Keynote: Analyst",A push into robotics and the unveiling of the Nvidia 5000 Series GPUs are items to watch at CES. An analyst questions how quick the items will turn into revenue.
2025-01-06 16:31:22+00:00,Arbe Robotics Stock Jumps On NVIDIA Collaboration - What's Going On?,Arbe Robotics partners with NVIDIA to enhance free space mapping and AI capabilities for auto industry at CES 2025.
2025-01-06 15:49:40+00:00,"Benzinga Market Summary: AI And Chip Stocks Rise Amid Microsoft AI Investment Plans, Fubo and Hulu + Live TV To Combine, Natural Gas Continues Higher",
2025-01-06 15:00:14+00:00,Investigating NVIDIA's Standing In Semiconductors &amp; Semiconductor Equipment Industry Compared To Competitors, 
2025-01-06 14:18:30+00:00,"Top 10 Trending Stocks On WallStreetBets As Of January 6, 2025 (Via Swaggy Stocks)",
2025-01-06 13:53:22+00:00,"AI Chip Stocks Nvidia, Broadcom, AMD, Taiwan Semi, Micron, Super Micro Surge Premarket: Whats Going On?","Semiconductor chip stocks, including Nvidia, AMD, Broadcom, TSM, STM, MRVL, MU, ARM, and SMCI surged ahead of CES, boosted by Microsoft&#39;s $80B AI investment and Foxconn&#39;s record revenue."
2025-01-06 13:46:34+00:00,Nvidia Stock Surges In Monday Pre-Market Ahead Of Jensen Huang's CES Keynote,"This sentiment previously boosted Nvidia&#39;s stock, with Huang describing demand as &#34;insane&#34; in October."
2025-01-06 11:24:29+00:00,"US Stocks To Open Higher In Yet Another Truncated Week: Nvidia, Robotic Stocks In Focus Ahead Of CES 2025",U.S. stock futures advanced on Monday after ending their losing streak on Friday. Futures of all four major indices rose in premarket trade.
2025-01-06 10:22:32+00:00,"S&P 500 Snaps Five-Day Losing Streak, Nvidia Surges: Investor Fear Eases, Greed Index Remains In 'Fear' Zone", 
2025-01-06 10:17:00+00:00,"Apple Supplier Foxconn Posts Record Revenue, Rides High On AI Server Demand And Nvidia Partnership",Apple and Nvidia supplier Foxconn posted a record topline in Q4 driven by higher cloud and networking and strong demand from AI servers.
2025-01-06 09:01:16+00:00,"Short-Seller Jim Chanos Warns Of Overbuilding Data Center Capacity, Compares AI Boom To Fiber Optic Bubble Of 2000s","Renowned short-seller Jim Chanos is warning of potential overbuilding in the data center sector, drawing parallels to the 2000 fiber optic bubble."
2025-01-07 21:39:57+00:00,"Watching Shares Of Quantum Computing Stocks; Traders Circulate Comments From Jensen Huang Saying He Loves Quantum Computing But Not To Expect A Quantum Computer For 15 Years At The Earliest, Looked At His CFO And Said ""But Probably 30 Years Away""",
2025-01-07 21:47:40+00:00,3 Digital Infrastructure ETFs In Focus As Trump Reveals Billion-Dollar Data Center Construction Plan,Trump: $20B investment in data centers by DAMAC. Microsoft: $80B investment plan for AI-driven centers. ETFs offer opportunity to invest in digital infrastructure.
2025-01-07 21:29:52+00:00,Nvidia Stock Closed Tuesday Down 6% After Hitting All-Time Highs: What Happened?,Nvidia Corporation (NASDAQ: NVDA) shares traded lower on Tuesday following product announcements made during CES 2025. Broader weakness across markets following economic data Tuesday morning also appears to have weighed on shares. Here&#39;s what you need to know.
2025-01-07 21:15:20+00:00,NVIDIA Unveils AI-Powered Digital Twin Tech For Warehouse Operations,"NVIDIA (NASDAQ: NVDA) launches the Mega Omniverse Blueprint, an AI-powered digital twin solution designed to optimize warehouse and factory operations. This new technology allows enterprises to simulate environments, improving efficiency through robotic decision-making, route planning, and sensor data testing."
2025-01-07 20:57:01+00:00,"Top 10 Stock Traders In Congress For 2024: How Nancy Pelosi, Pete Sessions, Susan Collins, Marjorie Taylor Greene Rank",A look at the top 10 members of Congress for stock portfolio return in 2024.
2025-01-07 20:42:23+00:00,SoundHound AI Shares Drop Amid Sector Weakness: What's Going On,"SoundHound AI, Inc. (NASDAQ: SOUN) shares are trading lower Tuesday as the broader tech sector declined. The drop followed economic data and rising Treasury yields and NVIDIA Corp&#39;s (NASDAQ: NVDA) announcements at CES 2025."
2025-01-07 19:52:00+00:00,Nvidia Stock Drops After Huang's CES Keynote: Analysts Dub It 'End-To-End AI Shop',Nvidia stock fell Tuesday after Jensen Huang&#39;s CES keynote. Analysts share reasons why and look to what&#39;s ahead for the tech giant.
2025-01-07 18:13:12+00:00,"Benzinga Market Summary: NVIDIA Falls As Market Digests CES Announcements, S&P Slides As Yields Gain Following Economic Data, Gold And Silver Rise, Adobe Analytics Data Show Record Holiday Sales",
2025-01-07 18:10:00+00:00,"Stocks Sink As Bond Yields Soar, Nvidia Eyes Worst Day In 4 Months, Bitcoin Tumbles To $97,000: What's Driving Markets Tuesday?","Tuesday began as a calm day on Wall Street, but markets swiftly turned negative after the Institute for Supply Management released data highlighting an unexpected surge in price pressures within the service sector for Decemb"
2025-01-07 17:43:58+00:00,Logitech's Streamlabs Teams With NVIDIA To Simplify Streaming With AI,"LOGI shares up premarket as Streamlabs partners with NVIDIA and Inworld AI to launch AI-powered streaming assistant, enhancing live streaming experience."
2025-01-07 17:42:59+00:00,ChatGPT Moment For Robotics Is Around The Corner Says Nvidia CEO, 
2025-01-07 17:35:11+00:00,10 Information Technology Stocks Whale Activity In Today's Session, 
2025-01-07 16:43:27+00:00,"Live On BloombergTV, Nvidia CEO Jensen Huang Discusses New Graphics Cards Announced At CES Event",
2025-01-07 16:21:17+00:00,Nvidia CFO Says Growth From AI Roll Out To Last Decade; Says Has A Lot Of Growth Opportunity In Future,
2025-01-07 16:16:35+00:00,Micron Pops On Nvidia Partnership Buzz: Could Blackwell Chips Be The Memory Maker's Big Break?,Micron stock surges after Nvidia CEO praises their chips at CES. But mixed technical signals may impact the rally.
2025-01-07 15:55:21+00:00,Nvidia CFO Colette Kress To Present At J.P. Morgan Conference At 11:00 ET In CES Fireside Chat,
2025-01-07 15:48:09+00:00,"Benzinga Market Summary: Bitcoin Falls, Vaccine Stocks Rise On Bird Flu Concerns, NVIDIA Drops",
2025-01-07 15:38:22+00:00,"US Services Sector Growth Tops Forecasts, But 'Tariff Concerns,' Price Pressures Cast A Shadow",US services sector shows resilience but tariff concerns and rising prices are casting shadows over the optimistic economic picture.
2025-01-07 15:22:19+00:00,Innoviz Technologies Stock Is Surging Tuesday: What's Driving The Action?,"Innoviz Technologies Ltd (NASDAQ:INVZ) shares are surging Tuesday after the company announced plans to showcase its perception software at CES 2025, demonstrating how it runs on Nvidia Corp&#39;s (NASDAQ:NVDA) Drive Orin platform. "
2025-01-07 15:00:13+00:00,Investigating NVIDIA's Standing In Semiconductors &amp; Semiconductor Equipment Industry Compared To Competitors, 
2025-01-07 14:17:35+00:00,"Top 10 Trending Stocks On WallStreetBets As Of January 7, 2025 (Via Swaggy Stocks)",
2025-01-07 14:10:20+00:00,Nvidia Hits Record Highs On CES AI Breakthroughs: Goldman Stays Bullish,"
Nvidia&#39;s stock reaches all-time high following CES 2025 presentation, emphasizing Physical AI and unveiling new GPUs for gaming and creative computing. CEO Jensen Huang predicts Physical AI as the next big industry and introduces open platform Cosmos for AI development."
2025-01-07 13:36:42+00:00,"Nvidia Highlights AI Chips Powering PUBG, Robotics 'ChatGPT Moment,' Automotive Expansion And More At CES Event","Nvidia Corp maintains upward stock trajectory with new product announcements at CES, strategic partnerships with Microsoft, Foxconn, Toyota, and Meta."
2025-01-07 13:26:57+00:00,"Taiwan Semiconductor Ramps Up Production in Japan, US, and Germany to Diversify Away from China","Taiwan Semi to ramp up production in US &amp; Germany, with 2nm progress and AI chip market growth. Microsoft to invest $80B in AI data centers."
2025-01-07 13:12:32+00:00,"Innoviz, In Collaboration With NVIDIA, Showcases Cutting-Edge Perception Software With NVIDIA DRIVE AGX Orin At CES 2025, Unveiling New Software-Driven Features",
2025-01-07 13:00:12+00:00,"US Stocks Could Open On A Tentative Note; Nvidia, AMD And Toyota On Investors' Radar: Experts Flag Over Reliance On AI, Tech Stocks","Precarious Tuesday opening for US stocks amidst mixed Monday close. AI, chipmakers and Toyota in focus."
2025-01-07 12:42:09+00:00,Aurora Teams Up With NVIDIA & Continental To Power Driverless Trucks: Details,"Aurora Innovation partners with NVIDIA and Continental to deploy driverless trucks using NVIDIA&#39;s DRIVE Thor SoC, targeting 2025 launch."
2025-01-07 11:24:35+00:00,Uber And NVIDIA Partner On AI Technology For Autonomous Cars,"Uber Technologies has partnered with NVIDIA to boost AI-driven autonomous vehicle development. The collaboration integrates NVIDIA&#39;s Cosmos and DGX Cloud platforms, which streamline AI model creation and deployment."
2025-01-07 12:08:48+00:00,"Benchmark Reiterates Buy on NVIDIA, Maintains $190 Price Target",
2025-01-07 12:04:26+00:00,Software IP Licensor Ceva Says Its NeuPro-Nano Embedded AI NPUs Gain Traction In AIoT And MCU Markets,
2025-01-07 11:19:42+00:00,"Nasdaq Jumps Over 1% As Nvidia, Micron Surge: Investor Fear Eases, But Greed Index Remains In 'Fear' Zone","CNN Fear &amp; Greed Index at 36.7, easing fear level. S&amp;P 500 and Nasdaq gain, chip stocks up after Foxconn reports record revenue."
2025-01-07 10:30:56+00:00,Ambarella Launches N1-655 edge GenAI System-On-Chip (SoC) To Support Large-Language Models,
2025-01-07 10:00:07+00:00,Jensen Huang Unveils $3000 'Personal AI Supercomputer' The Size Of A Small Book: 'It Runs The Entire Nvidia AI Stack',"Nvidia CEO Jensen Huang unveiled Digits, a $3,000 personal AI supercomputer the size of a small book, capable of running advanced AI models."
2025-01-07 08:16:55+00:00,"Amid Nvidia's CES 2025 Buzz, Investors Overlooked Apple Supplier Foxconn's Strong Q4, Says Jim Cramer","Leading market analysts highlighted Foxconn&#39;s surprise Q4 performance, with Jim Cramer suggesting investors may have overlooked the company."
2025-01-07 06:55:12+00:00,"Reported Earlier, NVIDIA DRIVE Hyperion Receives TÜV Safety Nod, Poised To Accelerate Autonomous Vehicle",
2025-01-07 03:53:50+00:00,Jensen Huang Unveils Monster GPUs: Nvidia's RTX 5000 Series Starting At $549,"Nvidia CEO Jensen Huang unveiled the RTX 5000 GPU series, laptops powered by RTX 50-series, and the Grace Blackwell NVLink 72 system during his CES 2025 keynote, highlighting significant advancements in AI and GPU technology."
2025-01-07 06:53:11+00:00,"Reported Earlier, Aurora Partners With Continental And NVIDIA To Launch Next-Generation Driverless Trucks By 2027",
2025-01-07 06:50:44+00:00,"Reported Earlier, Logitech G's Streamlabs Partners With NVIDIA And Inworld To Launch Intelligent 3D Streaming Assistant",
2025-01-07 06:47:25+00:00,"Reported Earlier, NVIDIA Introduces Personal AI Supercomputing With Grace Blackwell-Powered Project DIGITS",
2025-01-07 06:41:02+00:00,"Reported Earlier, KION, NVIDIA, And Accenture Transform Warehousing With AI-Powered Robots And Digital Twin Technology",
2025-01-07 06:34:48+00:00,"Nvidia Supercomputer, Operating System To Power Toyota's Next-Gen Vehicles","Japanese automaker Toyota Motor will use Nvidia&#39;s Drive AGX Orin supercomputer and operating system for advanced driver assistance features on its next-generation models, the chipmaker said on Monday."
2025-01-07 06:22:36+00:00,"Reported Earlier, Uber Taps NVIDIA's Cosmos and DGX Cloud To Drive AI-Powered Autonomous Vehicle Innovation",
2025-01-07 06:04:50+00:00,"Jensen Huang's CES 2025 Vision Sparks Mixed Reactions: Ross Gerber Says Nvidia Has 'Changed The World,' While Analysts Debate AI And Autonomous Driving Ambitions","Wall Street analysts and industry experts offered mixed reactions to NVIDIA Corp.&#39;s ambitious technological roadmap unveiled at CES 2025 on Monday, particularly regarding its artificial intelligence and autonomous driving initiatives."
2025-01-07 04:44:34+00:00,"Gary Black's The Future Fund Lists Tesla As 3rd-Largest Holding, Behind Nvidia And Alphabet, Despite Delivery Miss","Tesla Inc. has climbed to become the third-largest holding at The Future Fund LLC, behind NVIDIA Corp. and Alphabet Inc., managing partner Gary Black announced Monday on X."
2025-01-07 02:17:21+00:00,"Bitcoin Makes Its Move Over $100K, Ethereum, Dogecoin Rally As Corporate BTC Adoption Strengthens: Analyst Says Ongoing BTC Run Different From Past Cycles","Leading cryptocurrencies jumped on Monday, driven by corporate Bitcoin purchases and a fresh bullish price prediction for 2025."
2025-01-08 21:51:44+00:00,"Bloomberg: Biden to Further Limit Nvidia, AMD AI Chip Exports in Final Push",
2025-01-08 20:45:58+00:00,"Options Corner: Trade The Ride, Not The Direction Of SoundHound AI","While SoundHound AI&#39;s big drop may tempt value hunters, a potentially smarter proposition calls for a wager on rising volatility."
2025-01-08 20:07:17+00:00,SoundHound AI Shares Are Falling Today: What's Going On?,SoundHound AI Inc.&#39;s (NASDAQ: SOUN) shares are trading lower today potentially from continued momentum due to sector-wide challenges. 
2025-01-08 19:00:39+00:00,Wall Street Bullish on Nvidia Following Advanced AI Development Announcement at CES 2025,"Wall Street analysts upgraded Nvidia (NVDA) after CES 2025. CEO Jensen Huang envisions a future of advanced AI, requiring massive data centers."
2025-01-08 18:28:18+00:00,"Intel Partners with Amazon Cloud to Drive Next-Gen Smart Vehicle Tech, Wins Stellantis, Karma Auto As Clients","Intel showcased its expanded product portfolio and partnerships for electric and software-defined vehicles at CES 2025, targeting cost reductions and performance improvements."
2025-01-08 18:03:03+00:00,"Wall Street Mixed Ahead Of Fed Minutes, Dollar Bolsters Strength, Bitcoin Falls Below $95,000: What's Driving Markets Wednesday?","Wall Street began Wednesday with muted trading, as investors braced for the release of the December Federal Open Market Committee meeting minutes."
2025-01-08 17:39:45+00:00,"Uber, Nvidia Partnership To Unlock Value By Leveraging AI To Advance Ridesharing, Autonomous Tech: Analyst","Analyst maintains Buy rating on Uber with $96 price target after its partnership with Nvidia to develop AVs, leveraging Uber&#39;s data and Nvidia&#39;s AI platform."
2025-01-08 17:35:11+00:00,10 Information Technology Stocks With Whale Alerts In Today's Session, 
2025-01-08 17:33:09+00:00,"Verizon Hits 5.5 Gbps 5G Speeds, Lands Air Force Deal to Upgrade Base Networks Nationwide",Verizon announced 5.5 Gbps download speeds using carrier aggregation and virtualized 5G tech. Also selected by USAF for 5G and network upgrades.
2025-01-08 16:52:45+00:00,"Nvidia CEO Jensen Huang Wants To Congratulate Trump At Mar-A-Lago, But Hasn't Been Invited Yet","Nvidia CEO Jensen Huang is a leader in the tech and AI fields. While other tech leaders have met with Donald Trump at Mar-A-Lago, Huang hasn&#39;t been invited."
2025-01-08 15:54:42+00:00,"Watching Shares Of Richtech Robotics; Company Post On X, ""We are thrilled to announce that Richtech Robotics and our beverage-making robot, ADAM, were featured in @nvidia's ""The AI Factory"" video…""",
2025-01-08 15:33:20+00:00,"Quantum Stocks Tumble: Why Rigetti, IonQ and D-Wave Are Falling",Quantum-related stocks are tumbling after Nvidia CEO Jensen Huang expressed skepticism about the near-term usefulness of quantum computers.
2025-01-08 15:32:46+00:00,"Failed Nvidia Breakout Burns Momo Crowd, Interest Rates Rise On Strong Economic Data", 
2025-01-08 14:16:29+00:00,"Top 10 Trending Stocks On WallStreetBets As Of January 8, 2025 (Via Swaggy Stocks)",
2025-01-08 14:15:41+00:00,Samsung's Outlook Dims Amid HBM Supply Struggles for Nvidia and Sluggish Consumer Chip Sales,Samsung Electronics expects lower operating profit due to R&amp;D costs and weak demand for memory chips. Nvidia approves Samsung&#39;s HBM chips for AI processors.
2025-01-08 14:12:15+00:00,Absci Stock Jumps As AMD Invests $20M To Boost AI Drug Discovery,Absci shares are rising after announcing a strategic collaboration with Advanced Micro Devices Inc. The partnership will enhance Absci&#39;s AI drug discovery capabilities using AMD Instinct accelerators and ROCm software. 
2025-01-08 14:06:58+00:00,Nvidia Teams Up With MediaTek to Challenge Intel and AMD in Desktop CPU Market,"Nvidia CEO Jensen Huang says MediaTek could sell desktop processor chip co-developed with Nvidia, showcased at CES 2025. AMD and Intel are key competitors."
2025-01-08 13:27:31+00:00,Micron's $7 Billion Bet on AI-Driven Memory In Singapore Facility Set to Boost Innovation," Micron Technology, Inc. (NASDAQ: MU) broke ground on a new HBM advanced packaging facility in Singapore, expanding its capacity and creating jobs.
 

"
2025-01-08 13:10:47+00:00,"Rosenblatt Maintains Buy on NVIDIA, Maintains $220 Price Target",
2025-01-08 10:45:27+00:00,US Stocks To Open Higher As Futures Advance: Christopher Wood Expects Trump's Inflationary Policies To Hurt Market,U.S. stock futures advanced on Wednesday after a lower close on Tuesday. Futures of all four major indices rose in premarket trade.
2025-01-08 08:34:30+00:00,"S&P 500 Down Over 1% As Nvidia, Tesla Tumble: Greed Index Remains In 'Fear' Zone", 
2025-01-08 07:50:43+00:00,"Nvidia's Jensen Huang Said Something That Has All Quantum Computing Stocks Tumbling: QUBT And RGTI Down 13%, IONQ Down 11%","Nvidia collaborates with nearly every quantum computing company worldwide, extending their CUDA platform to quantum applications"
2025-01-08 06:28:40+00:00,Sam Altman's Sister Files Lawsuit Against OpenAI CEO Alleging Sexual Abuse — Family Respond: 'Deeply Hurtful And Entirely Untrue',"OpenAI CEO Sam Altman faces allegation from his sister Ann Altman, who filed a lawsuit Monday claiming sexual abuse, amid multiple legal challenges confronting the artificial intelligence company."
2025-01-08 06:18:49+00:00,Jim Cramer Sees Buying Opportunity In Nvidia But Attributes 6% Fall To 'Too Much Hot Money' After Jensen Huang's CES Keynote,"Jim Cramer urged investors to consider NVIDIA Corp.&#39;s  recent stock decline as a buying opportunity, despite the company&#39;s shares falling 6.22% on Tuesday following CEO Jensen Huang&#39;s CES 2025 keynote presentation."
2025-01-08 04:14:49+00:00,Nvidia 5000 Series: RTX 5090 Version For China Costs $250 More But Its AI Power Cut 29% — Here's Why,"Nvidia launched the RTX 5090D, a China-specific version of its RTX 5090 GPU with a 29% reduction in AI performance to comply with U.S. export sanctions while maintaining most specifications of the global model."
2025-01-08 02:16:58+00:00,"Nvidia, Palantir, Ionq, Novavax, And Tesla: Why These 5 Stocks Are On Investors' Radars Today","The U.S. stock market experienced a downturn on Tuesday, with the Nasdaq Composite falling by 1.9% and the S&amp;P 500 dropping by 1.1%.."
2025-01-08 02:02:04+00:00,Amazon AWS To Invest $11 Billion In Georgia To Boost AI And Cloud Infrastructure: 'Expect To Create More Than 550 Well-Paying Jobs',"Amazon AWS announced a $11 billion investment in Georgia to enhance AI and cloud infrastructure, creating over 550 jobs while contributing to the growing energy demands of data centers in the U.S."
2025-01-08 01:11:13+00:00,Trump Vows To Power AI Boom With Expanded Oil Drilling: 'Need Double The Electricity At Least That We Have Right Now',Trump plans to accelerate AI innovation and increase energy production by expanding deregulation and overturning Biden&#39;s offshore drilling ban.
2025-01-09 20:24:51+00:00,"Bitcoin ETFs Quadruple SPY Returns, Magnificent 7 Plays Catch-Up",Bitcoin (CRYPTO: BTC) ETFs delivered over 100% gains in 2024. That’s four times the returns of the S&amp;P 500 index.
2025-01-09 19:00:25+00:00,"Biden's Final Chip Curbs Set To Shake AI Markets: 10 ETFs With High Stakes In Nvidia, AMD","Biden admin plans to update export rules targeting advanced semiconductors, restrict access for China and other &#39;adversaries&#39;. Nvidia and AMD may see impact, major ETFs heavily exposed to them."
2025-01-09 18:38:16+00:00,"Quantum Stocks Regetti Computing, IonQ, D-Wave Poised To Open Higher After Nvidia CEO Comments Drove Huge Losses",Quantum computing stocks such as Rigetti Computing and IonQ were clobbered Wednesday following comments from Nvidia CEO Jensen Huang suggesting the technology is decades away from practical use. 
2025-01-09 17:54:57+00:00,Nvidia Teams Up with Dutch Government to Build Cutting-Edge AI Supercomputer Facility,NL govt signs AI facility deal with Nvidia worth 204.5 million euros. Biden admin considering additional chip sanctions. ASML could benefit.
2025-01-09 17:35:11+00:00,10 Information Technology Stocks With Whale Alerts In Today's Session, 
2025-01-09 15:00:11+00:00,Comparing NVIDIA With Industry Competitors In Semiconductors &amp; Semiconductor Equipment Industry, 
2025-01-09 14:30:44+00:00,Nvidia and AI Chip Stocks Brace for Impact as Biden Administration Considers New China Export Ban: Report,"Biden may impose new sanctions on AI chip exports to China, limiting sales to allies like Germany and Japan. US companies can apply for exceptions."
2025-01-09 13:54:52+00:00,Japanese Chipmaker Rapidus Sets Sight on Broadcom to Emulate Taiwan Semiconductor's Market Dominance,Japanese chipmaker Rapidus to supply 2-nm chip samples to Broadcom in June. Japan&#39;s focus on semiconductors amid supply chain disruptions. Broadcom eyes $150B AI opportunity backed by 2-nm and 3-nm technology and partnerships with Google and Meta Platforms.
2025-01-09 09:02:19+00:00,"Jensen Huang Is 'Dead Wrong' About Quantum Computing, D-Wave CEO Fires Back At Nvidia Boss: 'Happy To Meet With Jensen Any Time, Any Place, To Help Fill In These Gaps'",D-Wave CEO Alan Baratz criticized Nvidia CEO Jensen Huang&#39;s assertion that practical quantum computing is 15-30 years away.
2025-01-09 08:55:21+00:00,"Nvidia's CES Setback Mirrors 2007 iPhone Launch, Says Dan Ives: 'Jensen Plays Chess While Others Are Playing Checkers'","NVIDIA shares fell 6.22% following Jensen Huang&#39;s CES 2025 keynote, prompting Dan Ives to draw parallels with Apple&#39;s iPhone launch in 2007."
2025-01-09 02:58:19+00:00,SoftBank-Owned Arm Eyes Acquisition Of Oracle-Backed Chip Designer Ampere Computing Amid Nvidia's Dominance: Report,"Arm Holdings PLC is exploring the potential acquisition of semiconductor designer Ampere Computing LLC, signaling further consolidation in the artificial intelligence chip sector."
2025-01-09 01:41:13+00:00,Jim Cramer Warns On 'Quantum Stories' As Stocks Plunge: 'We Need You Out Before The Froth Goes Away',"Tech stocks faced steep declines Wednesday as prominent market commentator Jim Cramer warned investors about overvaluation in quantum computing and AI sectors, following earlier skepticism from NVIDIA Corp. CEO Jensen Huang about quantum technology&#39;s timeline."
2025-01-10 19:59:24+00:00,Semiconductor ETF Faces Key Resistance In AI-Driven Surge: Analyst,"iShares Semiconductor ETF (SOXX) faces resistance but offers strong value for investors with exposure to AI-driven growth from leading chipmakers like Nvidia, Broadcom, and AMD."
2025-01-10 19:26:40+00:00,Options Corner: Here's The Quantum Computing Game Plan Following The Fallout,"Although quantum computing stocks may appear as deep-value prospects, investors should carefully assess the underlying data."
2025-01-10 19:13:00+00:00,"Nvidia, Broadcom Among Goldman Highlights For AI Opportunities",Nvidia and chip stocks trading lower as Biden administration considers restricting AI chip exports to China. Taiwan Semi reports strong revenue.
