date,headline,summary
2025-01-28 14:22:45+00:00,"Top 10 Trending Stocks On WallStreetBets As Of January 28, 2025 (Via Swaggy Stocks)",
2025-01-28 13:49:33+00:00,"Market Clubhouse Morning Memo - January 28th, 2025 (Trade Strategy For SPY, QQQ, AAPL, MSFT, NVDA, GOOGL, META and TSLA)","Today&#39;s trading strategy For SPY, QQQ, AAPL, MSFT, NVDA, GOOGL, META and TSLA"
2025-01-28 13:46:01+00:00,"Broadcom, Marvell Could Thrive From DeepSeek's AI Breakthrough, Analyst Predicts","DeepSeek&#39;s latest AI model, R1, raises questions about AI chip demand with its low training cost. But history shows efficiency drives more demand."
2025-01-28 13:43:09+00:00,"Jim Cramer Squashes DeepSeek Hype, Warns Of AI 'Sputnik Moment' Amid Investor Frenzy And US-China 'Inferiority Complex'",Jim Cramer alluded to the Chinese artificial intelligence startup DeepSeek&#39;s hype and compared it to the 1957&#39;s Sputnik moment.
2025-01-28 12:50:27+00:00,DeepSeek Buzz Batters Big Tech But This Analyst Says 'Buy The Dip:' Here's Are Top 5 Semiconductor ETFs With The Lowest Expense Ratios That You Can Consider,"As analysts suggest buying the dip after DeepSeek fueled the selloff, here is a list of semiconductor ETFs that investors could consider."
2025-01-28 11:42:21+00:00,"Nvidia, Broadcom Gain Over 5% As Tech Giants Rebound After Monday Sell-Off: What's Going On?","After Monday&#39;s dramatic crash, tech stocks made a solid recovery in Tuesday&#39;s premarket. Nvidia led the way, climbing over 5%."
2025-01-28 09:47:25+00:00,"Fundstrat's Tom Lee Sees Nvidia's 17% Plunge As An 'Opportunity,' Calls Nasdaq's Over 600 Points Plunge Drop A Market 'Overreaction'","Fundstrat Global Advisors&#39; head of research Tom Lee believes Monday&#39;s massive tech sector sell-off, which saw Nvidia Corp. shares plunge 17%, represents a buying opportunity rather than a fundamental shift in the artificial intelligence landscape."
2025-01-28 09:26:21+00:00,Billionaire Investor Ray Dalio Sounds Alarm On Potential AI Stock Bubble Akin To Dotcom Crash: '...Very Similar To Where We Were Between 1998 Or 1999',Billionaire investor Ray Dalio issued a warning on Monday about a potential bubble in U.S. artificial intelligence (AI) stocks.
2025-01-28 08:40:50+00:00,Jensen Huang Says 'Everything That Moves Will Be Robotic Soon' As Nvidia CEO Envisions Star Wars-Inspired R2-D2 Personal Assistants And Humanoid Robots,"Nvidia Corp. CEO Jensen Huang predicts a future dominated by robotics and artificial intelligence, even as the semiconductor giant faces growing competition in the AI space. "
2025-01-28 08:37:53+00:00,Ross Gerber Slams DeepSeek's Privacy Policy As The Chinese AI Model's Rise Triggers Market Chaos: 'I Don't Trust A Thing China Does',"Investor Ross Gerber criticized DeepSeek&#39;s privacy policy, expressing distrust of China&#39;s handling of user data."
2025-01-28 07:42:36+00:00,DeepSeek Flags Fake Founder's Account On X As Open-Source AI Model Surpasses OpenAI's ChatGPT On Apple Store,"A Chinese artificial intelligence startup&#39;s rapid ascent in the AI space has sparked both security concerns and market ripples. DeepSeek, which recently surpassed OpenAI&#39;s ChatGPT on Apple Inc.&#39;s App Store, issued warnings about fake social media accounts impersonating its founder Liang Wenfeng."
2025-01-28 07:28:54+00:00,"Gamestop Short Seller Wants Freedom Of Speech For 'Millions' Having Stock Market Conversations, Questioning SEC On 'What Protects Honest Opinions?'","Andrew Left, founder of Citron Research filed a petition with the SEC arguing for the protection of free speech in online market discussions."
2025-01-28 07:26:42+00:00,Trump Says Its Time For US To 'Return' To A System That Made It Rich And Powerful As The President Proposes Tariffs On Taiwan: 'Bring Production Back To Our Country',"President Donald Trump&#39;s pledge to impose sweeping tariffs on imports from Taiwan is raising concerns across semiconductor and pharmaceutical industries, particularly affecting Taiwan Semiconductor Manufacturing Co., the world&#39;s largest contract chipmaker."
2025-01-28 04:35:25+00:00,"DeepSeek Suffers 'Degraded Performance,' Says Hit By 'Large-Scale Malicious Attacks' After Rapidly Emerging As App Store Chart Topper","Chinese AI startup DeepSeek faced significant cyberattacks amid its rapid rise, including topping the U.S. App Store and challenging AI giants with its cost-effective R1 language model."
2025-01-28 03:33:56+00:00,Chamath Palihapitiya Warns Of AI Shift: 'The Battle Is Now More About AI Inference Vs Training' As DeepSeek Sparks Nvidia Selloff,"Billionaire investor Chamath Palihapitiya has issued a stark warning about the shifting AI landscape, following Chinese startup DeepSeek&#39;s demonstration of a cost-efficient AI model that triggered a $600 billion selloff in Nvidia Corp. shares."
2025-01-28 01:55:35+00:00,Nvidia Says DeepSeek An 'Illustration' Of How New AI Models Can Be Created While Being Export-Control Compliant Amid $600 Billion Market Value Plunge,"Nvidia Corp. has thrown its support behind China&#39;s DeepSeek R1 artificial intelligence model, calling it &#34;an excellent AI advancement&#34; even as the startup&#39;s emergence triggered a historic $600 billion plunge in the chipmaker&#39;s market value on Monday."
2025-01-28 02:17:01+00:00,"Amid Nvidia And Chinese AI Anxieties, Top Analyst Predicts Higher AI Infrastructure Demand Despite Market Jitters: 'The Market Is Overreacting To DeepSeek's Success'","Nvidia&#39;s stock plummeted as China&#39;s DeepSeek gained attention for its cost-efficient AI models, but analyst Gene Munster argued the market is overreacting, predicting increased AI infrastructure investment driven by the potential for achieving artificial general intelligence."
2025-01-28 02:07:16+00:00,"Bitcoin, Ethereum, Dogecoin Recover As DeepSeek Troubles Mount For US Tech Stocks: Analyst Suggests BTC Could Hit Fresh Highs Over Upcoming Two Weeks",Leading cryptocurrencies pared early losses on Monday as DeepSeek concerns weighed on risk-on markets.
2025-01-28 01:42:05+00:00,"Nvidia, Broadcom, Nebius Group, Taiwan Semiconductor, And Tesla: Why These 5 Stocks Are On Investors' Radars Today","Monday&#39;s trading session saw mixed results in the U.S. stock market. The S&amp;P 500 dropped by 1.5% to 6,012.28, shedding nearly 90 points."
2025-01-29 21:41:34+00:00,"Bitcoin Flies Above $104,000 After Powell Remarks, Stocks Remain Stunned By AI Concerns","Bitcoin (CRYPTO: BTC) may have found a new friend in town, as Fed Chair Jerome Powell took a surprisingly open stance on crypto assets during his "
2025-01-29 20:43:50+00:00,Options Corner: Ambiguity Ahead Of AMD's Q4 Earnings Sweetens A 'Condor' Trade,"With Advanced Micro Devices offering mixed signals ahead of its Q4 earnings, a directionally neutral strategy may be best for AMD stock."
2025-01-29 19:59:43+00:00,Nvidia Faces Export Risks As US Officials Weigh Tougher AI Chip Limits For China,NVIDIA shares are moving lower on Wednesday amid reports indicating that Donald Trump administration officials are discussing further restricting NVIDIA&#39;s sales to China.
2025-01-29 19:46:56+00:00,"Why Nvidia, Broadcom, Marvell Are This Analyst's Top AI Bets In 'Sputnik Moment'","In the midst of AI’s rapid transformation, BofA Securities analyst Vivek Arya sees a significant opportunity for NVIDIA Corp (NASDAQ:NVDA), Broadcom Inc (NASDAQ:"
2025-01-29 19:41:26+00:00,"ANALYSIS: Deepseek's AI Innovations Should Help Nvidia, Not Hurt It","US markets frenzy over Chinese AI company Deepseek&#39;s model, causing chipmakers&#39; stocks to drop. But experts say it&#39;s a buying opportunity."
2025-01-29 18:50:50+00:00,AI ETFs In Focus As Alibaba Challenges DeepSeek With New Model,"AI arms race fueled by DeepSeek and Alibaba&#39;s AI models. Investors can profit from trend with AI-focused ETFs, including AIQ, ARKQ, QQQ."
2025-01-29 18:45:40+00:00,Betting Against Nvidia Again,So much for the Jevons paradox. 
2025-01-29 18:28:51+00:00,Nvidia Says It Is Ready To Work With The U.S. Administration As It Pursues Its Own Approach To AI,
2025-01-29 18:03:14+00:00,'Trump Officials Discuss Tightening Curbs On Nvidia-China Sales; U.S. Officials Are Focused On Potentially Expanding Restrictions To Cover Nvidia's H20 Chips' - Bloomberg,
2025-01-29 18:04:24+00:00,"Stocks Tick Down Ahead Of Fed Meeting, Nvidia Jitters Resume, Trump Media Rallies: What's Driving Markets Wednesday?",Caution dominates Wednesday&#39;s midday trading session in New York as investors anxiously await the Federal Open Market Committee decision at 2 p.m. ET.
2025-01-29 17:35:12+00:00,10 Information Technology Stocks With Whale Alerts In Today's Session, 
2025-01-29 16:53:30+00:00,"Alibaba Ups AI Game, Says Its Qwen2.5 Max Beats DeepSeek and OpenAI In Performance","Alibaba releases new version of its Qwen language model, surpassing rival DeepSeek and gaining popularity. Tech stocks plunge in premarket trading."
2025-01-29 15:45:23+00:00,Decoding NVIDIA's Options Activity: What's the Big Picture?, 
2025-01-29 15:05:31+00:00,"Taiwan Semiconductor Gains Government Support, Faces Trump's Tariff Threats, Cheaper Chinese Rivals","Taiwan promises to support chip industry amid US tariff threats. Taiwan&#39;s trade surplus with US surged 83% in 2024, with exports reaching $111.4B."
2025-01-29 15:02:43+00:00,Market Analysis: NVIDIA And Competitors In Semiconductors &amp; Semiconductor Equipment Industry, 
2025-01-29 14:44:41+00:00,"Benzinga Market Summary: S&P Slips Ahead Of Fed Decision, RFK Jr. Confirmation Hearings To Begin Today, T-Mobile Surges On Earnings Beat, Chip Stocks Are Mixed At Open",
2025-01-29 14:26:11+00:00,"Top 10 Trending Stocks On WallStreetBets As Of January 29, 2025 (Via Swaggy Stocks)",
2025-01-29 14:23:48+00:00,"DeepSeek Selloff Is A Correction, Not Start Of 'Sustained Bear Market': Goldman Sachs","Goldman Sachs sees temporary setback, not bear market. High market concentration poses risk but also opportunity to diversify and stay invested."
2025-01-29 13:59:15+00:00,"EXCLUSIVE: Nvidia Hardest Hit Among Mag 7 Stocks By DeepSeek, Poll Shows — And This Stock Ranked Second",A Benzinga reader poll shows which Magnificent 7 stocks could be the most hurt if DeepSeek continues to emerge as a key player in the AI space.
2025-01-29 13:58:01+00:00,"Broadcom Launches Secure Fibre Channel HBA, Boosting Data Encryption To Combat Rising Cyber Threats",AVGO announced Emulex Secure Fibre Channel Host Bus Adapters for real-time ransomware protection. Quantum computers increase risk of data breaches.
2025-01-29 13:45:41+00:00,"DeepSeek's AI Breakthrough Benefits Microsoft, But Oracle Faces Cloud Growth Challenges: Analyst","DeepSeek&#39;s AI models, built using less-powerful chips at a lower cost, have positive implications for Microsoft and negative for Oracle."
2025-01-29 13:25:02+00:00,US Surpasses China As Nvidia Supplier ASML's Largest Market For Chipmaking Gear In Q4: Stock Rises Over 5% In Wednesday Premarket,"Dutch chip equipment maker ASML Holding NV beat the fourth quarter earnings estimates and posted record net sales on an annual and sequential basis, on Wednesday. The company also reduced its Chinese market share in Q4. "
2025-01-29 12:40:07+00:00,"Marjorie Taylor Greene Loads Up On Meta, Amazon, Tesla, Nvidia And Other Stocks As Donald Trump's New Equations With Big Tech Leaders Sets Stage For Growth: What Is At Stake? (UPDATED)",U.S. House Representative Marjorie Taylor Greene has disclosed new trades as Donald Trump&#39;s equations evolves with Big Tech leaders.
2025-01-29 12:12:02+00:00,Arm China Eyes Leadership Change As AI Boom And US-China Relationship Reshape Industry," British chipdesigner Arm Holdings Plc&#39;s Chinese venture is eyeing Chen Feng as new CEO, to take over from co-CEOs Liu Renchen and Eric Chen.British chipdesigner Arm Holdings Plc&#39;s Chinese venture appoints Chen Feng as new CEO, replacing co-CEOs Liu Renchen and Eric Chen."
2025-01-29 11:16:17+00:00,"US Futures Point To Cautious Start As Investors Await Fed's Rate Decision: Tesla, Microsoft, Meta Among Stocks In Focus Ahead Of Earnings",U.S. stock futures were mixed ahead of the crucial earnings from key U.S. technology companies and the Fed&#39;s expected pause on rate cuts.
2025-01-29 10:22:56+00:00,Black Swan Author Nassim Taleb Says Nvidia Stock's 17% Drop On Monday Is 'Just The Beginning' Of Market Rout,"&#34;Black Swan&#34; author Nassim Taleb is warning investors about the fragility of wealth concentration in technology stocks, particularly highlighting Nvidia Corp. following its recent 17% decline amid the emergence of DeepSeek&#39;s artificial intelligence model."
2025-01-29 10:12:02+00:00,Dan Ives Says Chinese Startup DeepSeek's $6 Million AI Development Assertion Is 'Likely A Fictional Story',"Dan Ives has cast doubt on DeepSeek&#39;s claim of developing its AI model for $6 million, calling it &#34;likely a fictional story,&#34;."
2025-01-29 09:17:52+00:00,OpenAI Alleges DeepSeek Used Proprietary Models Without Permission As Microsoft Investigates AI Security Risks: 'There's Substantial Evidence',OpenAI announced it has uncovered evidence that Chinese artificial intelligence startup DeepSeek allegedly used its proprietary models.
2025-01-29 08:43:13+00:00,"Nasdaq Jumps 2% After Nvidia, Other Tech Stocks Bounce Back From DeepSeek Hit: Greed Index Remains In 'Fear' Zone","The CNN Money Fear and Greed index tracks market sentiment with 7 indicators. On Tuesday, it rose slightly but remained in the Fear zone."
2025-01-29 08:15:33+00:00,"Nvidia Supplier ASML Beats Q4 Earnings Estimates, CEO Says 'AI Is Key Driver For Growth:' Buy, Sell, Or Hold? Here's What Technical Analysis Suggests","ASML Holding NV, a supplier to Nvidia beat its earnings estimate in Q4. Here&#39;s what technical analysis, consensus analyst ratings suggest."
2025-01-29 05:48:19+00:00,"Palmer Luckey Blasts Hysteria Over DeepSeek, Oculus-Founder Says Chinese Hedge Fund's 'Psyops' Targeted US AI Giants Like Nvidia","Palmer Luckey has criticized the panic over China&#39;s DeepSeek AI, alleging that a Chinese hedge fund is using psychological operations to undermine U.S. tech giants like Nvidia while obscuring sanction evasion."
2025-01-29 05:39:53+00:00,Jim Cramer Says The 'Shoot First Learn Later' Crowd Got 'Hosed' As Nvidia And Other Tech Stocks Stage Recovery After DeepSeek Turmoil,"Jim Cramer took aim at panic sellers Tuesday as major tech stocks recovered from a sharp decline triggered by Chinese artificial intelligence startup DeepSeek&#39;s market entrance, with NVIDIA Corp. leading the rebound with an 8.82% gain."
2025-01-29 04:04:15+00:00,Dan Ives Expects Meta And Microsoft To Stand Firm On $60 - $80 Billion AI Spending Plans Amid DeepSeek's Disruptive AI Model,"Wedbush Securities analyst Dan Ives expects Meta Platforms Inc. and Microsoft Corp. to stand firm on their ambitious artificial intelligence spending plans during their upcoming earnings calls, despite recent market jitters over Chinese AI startup DeepSeek&#39;s emergence."
2025-01-29 03:04:59+00:00,Bill Ackman Questions Whether DeepSeek AI's Hedge Fund Affiliate Profited From Nvidia's Sell-Off: 'A Fortune Could Have Been Made',"Billionaire investor Bill Ackman questioned whether DeepSeek&#39;s hedge fund affiliate potentially profited from Monday&#39;s tech stock rout, which saw Nvidia Corp. shares plunge 17% following the Chinese artificial intelligence startup&#39;s emergence as a potential disruptor."
2025-01-29 02:07:57+00:00,Trump White House Puts DeepSeek Under National Security Scanner: 'Wake-Up Call To The American AI Industry',"The White House is reviewing China&#39;s DeepSeek AI for potential national security risks, amid growing concerns over intellectual property theft and its impact on U.S. AI dominance."
2025-01-29 02:00:48+00:00,"Bitcoin, Ethereum, Dogecoin Dip As Stocks Rebound: Top Trader Anticipates BTC's Fall To $99,000 But A 'Dovish' Fed Could Spark Recovery","Leading cryptocurrencies shed early gains on Tuesday, while stocks recovered well following Monday’s DeepSeek scare."
2025-01-30 22:10:02+00:00,"Helix Debuts AI Index Perpetual Market, Bridging Crypto And Traditional Equities On-Chain","Helix, a decentralized exchange built on Injective (CRYPTO: INJ), has launched an AI Index Perpetual Market, a product that allows investors to gain on-chain exposure to both AI-focused crypto tokens and traditional eq"
2025-01-30 20:24:32+00:00,"Meta's AI Investments, Llama Expansion, Ad Tech Growth Earn Analyst Conviction",Meta Platforms (NASDAQ: META) stock rose as firms raised price targets &amp; company reported strong Q4 sales. Analysts see potential in AI &amp; new services.
2025-01-30 17:35:12+00:00,10 Information Technology Stocks Whale Activity In Today's Session, 
2025-01-30 15:00:16+00:00,Investigating NVIDIA's Standing In Semiconductors &amp; Semiconductor Equipment Industry Compared To Competitors, 
2025-01-30 14:18:55+00:00,"Top 10 Trending Stocks On WallStreetBets As Of January 30, 2025 (Via Swaggy Stocks)",
2025-01-30 14:08:21+00:00,Why VOO Investors Should Keep Calm Despite AI Stock Turbulence,"JPMorgan analyst warns of turbulence in AI stocks like NVDA, AVGO, MRVL but reassures VOO investors due to its well-diversified portfolio of top US companies."
2025-01-30 11:04:29+00:00,"US Stocks Set For Gains Ahead Of Q1 GDP, Apple Earnings: Expert Says 'Higher January' Bodes Well For The Rest Of The Year","U.S. stock futures rose on Thursday, rebounding from a decline after the Federal Reserve&#39;s decision to hold interest rates steady."
2025-01-30 08:14:54+00:00,"Nasdaq Declines As Nvidia Edges Lower, Fed Leaves Interest Rates Unchanged: Fear & Greed Index In 'Neutral' Zone", 
2025-01-30 05:05:21+00:00,Microsoft CEO Satya Nadella Accepts DeepSeek AI Has Some 'Real Innovations' — But Won't Say If They Mark A Turning Point For AI Cost Reduction,"Microsoft CEO Satya Nadella acknowledged DeepSeek&#39;s AI advancements but avoided confirming whether they signal a major shift in AI cost reduction, instead emphasizing broader industry trends and software optimizations."
2025-01-30 03:59:10+00:00,"Mark Zuckerberg Says China's DeepSeek Did Some Novel Things 'We're Still Digesting,' But Meta May Keep Pouring Billions Into AI Infrastructure Anyway","Meta CEO Mark Zuckerberg acknowledged that China&#39;s DeepSeek made novel advancements that Meta is still evaluating but emphasized that the company will continue investing billions in AI infrastructure, seeing it as a long-term strategic advantage."
2025-01-30 02:47:24+00:00,"Tesla, Meta, Microsoft, IBM, Nvidia: Why These 5 Stocks Are On Investors' Radars Today","On Wednesday, January 29, 2025, TSLA, META, MSFT, IBM, NVDA were among the stocks that dominated investor attention on the day Federal Reserve chose to keep the interest rates steady."
2025-01-31 21:36:50+00:00,"Stocks Trim DeepSeek Losses, Fed Holds Steady, Trump Slaps 25% Tariffs On Canada, Mexico: This Week In The Markets",US stock market recovers losses as DeepSeek launches efficient AI platform. Fed Chair Powell&#39;s stance and strong earnings boost investor confidence.
2025-01-31 19:45:24+00:00,Options Corner: Tempus AI Stock Soars On Nancy Pelosi's Call Options — But Should Investors Follow?,"Although Nancy Pelosi buying Tempus AI call options is noteworthy, NEM stock is best reserved for advanced volatility traders."
2025-01-31 20:56:00+00:00,"Trump Says We Will Put Tariffs On Chips And Oil And Gas, Says Oil And Gas Tariffs By Feb 18",
2025-01-31 20:54:46+00:00,"EXCLUSIVE: This 'Magnificent 7' Stock Will Feel The Pinch Of Fed's Rate Decision, Poll Shows",Benzinga readers see two Magnificent 7 stocks most negatively impacted by the Federal Reserve&#39;s decision to hold rates steady.
2025-01-31 19:12:42+00:00,"Taiwan Bans DeepSeek AI Over Security Concerns, Joins Global Scrutiny of Chinese Tech",Taiwan&#39;s digital ministry urges against using Chinese AI service DeepSeek due to security concerns and maintains allegiance to US.
2025-01-31 18:35:19+00:00,White House Says Don't Have Details On Nvidia Meeting; Meeting Is At 2:30 pm ET,
2025-01-31 17:57:21+00:00,"Tech Stocks Rally, S&P 500 Flirts With Records, Gold Extends All-Time Highs: What's Driving Markets Friday?","Major stock indices have completed their recovery following Monday&#39;s sharp drop, buoyed by tech stocks rallying on the back of solid earnings and positive macroeconomic data.



The S&amp;P 500 index stands at 6,118 points at midday trading in New York, not far from the all-time high of 6,128 points reached last Friday."
2025-01-31 17:36:31+00:00,10 Information Technology Stocks With Whale Alerts In Today's Session, 
2025-01-30 16:36:49+00:00,"Humanoid Robots Bigger Than Evs, Retail Investors Buy $1B Nvidia But Institutions Sell, Microsoft Offers DeepSeek", 
2025-01-31 17:16:18+00:00,"Live On CNBC, Steve Weiss Announces Bought More Nvidia",
2025-01-31 16:16:25+00:00,Google Says Bringing Nvidia Blackwell GPUs To Google Cloud With Preview Of A4 VMS,
2025-01-31 15:00:15+00:00,Competitor Analysis: Evaluating NVIDIA And Competitors In Semiconductors &amp; Semiconductor Equipment Industry, 
2025-01-31 14:16:17+00:00,How Did DeepSeek Get Access To Nvidia Chips? US Investigates Possible Embargo Violation,US regulators have launched an investigation into Chinese AI startup DeepSeek&#39;s possible violation of US AI technology embargo against China.US regulators investigating DeepSeek for violating US AI tech embargo against China due to access to Nvidia semiconductors via intermediaries.
2025-01-31 13:41:14+00:00,Trump to Meet With Nvidia CEO At White House,
2025-01-31 12:04:53+00:00,China's DeepSeek-R1 Lands On Microsoft Azure And AWS — The Same Model That Shook Silicon Valley,"Microsoft and AWS have made DeepSeek-R1, the Chinese AI model that disrupted Silicon Valley, available on their cloud platforms, intensifying debates over AI cost efficiency and U.S. tech dominance."
2025-01-31 10:54:46+00:00,"DeepSeek's AI Model Shook Wall Street, But A New Report Says Chinese State Accounts Helped Fan The Flames","Chinese state-affiliated social media accounts reportedly amplified DeepSeek&#39;s AI launch just days before U.S. tech stocks tumbled, fueling concerns over coordinated influence campaigns and potential national security risks."
2025-01-31 10:09:27+00:00,"Nvidia RTX 5090 And 5080 Sell Out Instantly — Scalpers Jack Up Prices To $6,000 As Gamers Face 'Paper Launch' Frustration","Nvidia&#39;s RTX 5090 and 5080 GPUs sold out instantly upon launch, with scalpers inflating prices to $6,000, as low production yields and Nvidia&#39;s focus on data center chips exacerbated supply shortages."
2025-01-31 09:03:49+00:00,"Sam Altman Thanks Satya Nadella, Jensen Huang As OpenAI Deploys NVIDIA's GB200 On Microsoft Azure, Boosting Performance By 30X","OpenAI CEO Sam Altman announced a technological milestone on Friday, revealing the deployment of NVIDIA Corp.&#39;s  first full 8-rack GB200 NVL72 system on Microsoft Corp.&#39;s Azure platform, marking a major advancement in the companies&#39; strategic partnership."
2025-01-31 06:59:30+00:00,"Intel 'Will Be Fighting For Every Socket' In The Data Center Business, Says Co-CEO Michelle Holthaus As Competition From AMD, Nvidia Heats Up","Intel Corp. is taking a more combative stance in the data center market, signaling an aggressive pricing strategy to defend its territory against mounting competition from rivals like Advanced Micro Devices Inc. and NVIDIA Corp."
2025-01-31 04:10:53+00:00,Jim Cramer Wonders If Baidu Could Be Next After Alibaba's AI Model Outperforms DeepSeek,"Amid recent artificial intelligence sector turbulence, Jim Cramer wondered if Baidu Inc. might be the next Chinese tech giant to draw market focus."
2025-01-31 02:51:10+00:00,SoftBank May Lead OpenAI's $40 Billion Funding Round At A $300 Billion Valuation Despite DeepSeek Disruption: Report,"SoftBank Group is reportedly leading a $40 billion funding round in OpenAI, which values the artificial intelligence company at $300 billion. This is a significant increase from the $157 billion it was valued at a few months ago."
